"## START OF USER TABLE ##"
search_term,id,previous_kases,start_kases,case_id,lien_filed,special_instructions,case_description,injury_number,uuid,case_number,file_number,cpointer,source,adj_number,rating,injury_type,sub_in,main_injury_type,case_date,terminated_date,case_type,medical,td,rehab,edd,claims,venue_uuid,venue,venue_street,venue_suite,venue_city,venue_zip,venue_abbr,case_status,case_substatus,case_subsubstatus,submittedon,supervising_attorney,attorney,supervising_attorney_name,supervising_attorney_full_name,worker,interpreter_needed,case_language,applicant_id,applicant_uuid,applicant_salutation,first_name,last_name,full_name,language,dob,app_dob,ssn,applicant_email,applicant_phone,applicant_full_address,employer_id,employer_uuid,employer,employer_full_address,employer_suite,defendant_id,defendant_uuid,defendant,defendant_full_address,plaintiff_id,plaintiff_uuid,plaintiff,plaintiff_full_address,start_date,statute_limitation,end_date,ct_dates_note,occupation,name,case_name,attorney_id,user_id,attorney_name,attorney_full_name,worker_name,worker_full_name,lien_id,settlement_id,fee_id,referring_id,referring_uuid,referring,referring_full_address,referring_search,jetfile_id,personal_injury_date,closed_date
,3573,-1,1201,3509,N,,,1,KS55281bf21fc09,WC1132,,0,,,,,N,,04/10/15,00/00/00,WCAB,,,,,,KS538cb2585ec51,Anaheim,"1065 N. PacifiCenter Dr.",,Anaheim,92806,AHM,Open,,,"2015-04-10 11:52:34",3,,TS,"Thomas Smith",2,N,,,,,,,,,,,,,,,-1,,,,,-1,,,,-1,,,,00/00/00,00/00/00,00/00/00,,,,,,2,,,NG,"Nick Giszpenc",-1,-1,-1,-1,,,,,-1,,
,3861,-1,1201,3836,N,,,1,KS5552603e77024,WC1139,,0,,,,,N,,05/12/15,00/00/00,WCAB,,,,,,KS538cb2585fe3d,Oxnard,"1901 N. Rice Ave.","Suite 200",Oxnard,93030,OXN,Active,,,"2015-05-12 13:19:10",,,,,10,Y,English,,,,,,,,,,,,,,-1,,,,,-1,,,,-1,,,,00/00/00,00/00/00,00/00/00,,,,,,10,,,AA,"Alicia  Armas",-1,-1,-1,-1,,,,,-1,,
,5892,-1,1201,6210,N,,,1,KS55b980000888c,WC1162,,0,,,,,N,,07/29/15,00/00/00,WCAB,,,,,,KS538cb2585ec51,Anaheim,"1065 N. PacifiCenter Dr.",,Anaheim,92806,AHM,,,,"2015-07-29 18:38:08",3,8,TS,"Thomas Smith",6,N,English,,,,,,,,,,,,,,-1,,,,,-1,,,,-1,,,,00/00/00,00/00/00,00/00/00,,,,,8,6,av,"arturo valero",merc,"Mercedes Uribe",-1,-1,-1,-1,,,,,-1,,
,5905,-1,1201,6221,N,,,1,KS55ba7baf26a04,WC1172,,0,,,,,N,,07/30/15,00/00/00,WCAB,,,,,,KS538cb2585ec51,Anaheim,"1065 N. PacifiCenter Dr.",,Anaheim,92806,AHM,,,,"2015-07-30 12:31:59",6,3,merc,"Mercedes Uribe",2,N,,,,,,,,,,,,,,,-1,,,,,-1,,,,-1,,,,00/00/00,00/00/00,00/00/00,,,,,3,2,TS,"Thomas Smith",NG,"Nick Giszpenc",-1,-1,-1,-1,,,,,-1,,
,5907,-1,1201,6223,N,,,1,KS55ba7f5482edb,WC1173,,0,,,,,N,,07/30/15,00/00/00,WCAB,,,,,,KS538cb2585ec51,Anaheim,"1065 N. PacifiCenter Dr.",,Anaheim,92806,AHM,,,,"2015-07-30 12:47:32",13,3,KRP,"K R. Payman",6,N,,,,,,,,,,,,,,,-1,,,,,-1,,,,-1,,,,00/00/00,00/00/00,00/00/00,,,,,3,6,TS,"Thomas Smith",merc,"Mercedes Uribe",-1,-1,-1,-1,,,,,-1,,
,5963,-1,1201,6280,N,,,1,KS55d2105180062,WC1188,,0,,,,,N,,08/17/15,00/00/00,WCAB,,,,,,KS538cb2585f9c2,"Marina del Rey","4720 Lincoln Blvd ","2nd floor","Marina del Rey",90292,MDR,,,,"2015-08-17 09:48:17",,,,,2,N,,,,,,,,,,,,,,,-1,,,,,-1,,,,-1,,,,00/00/00,00/00/00,00/00/00,,,,,,2,,,NG,"Nick Giszpenc",-1,-1,-1,-1,,,,,-1,,
,6199,-1,1201,6517,N,,,1,KS5616cbd63f36a,WC1193,,0,,,,,N,,10/08/15,00/00/00,WCAB,,,,,,KS538cb2585f555,"Long Beach","300 Oceangate Street","Suite 200","Long Beach",90802,LBO,Open,,,"2015-10-08 13:02:30",,,,,,N,,,,,,,,,,,,,,,-1,,,,,-1,,,,-1,,,,00/00/00,00/00/00,00/00/00,,,,,,,,,,,-1,-1,-1,-1,,,,,-1,,
,6222,-1,1201,6534,N,,,1,KS56212806d5b61,WC1198,,WC1198,,,,,N,,10/16/15,00/00/00,WCAB,,,,,,KS538cb2585ec51,Anaheim,"1065 N. PacifiCenter Dr.",,Anaheim,92806,AHM,Open,,,"2015-10-16 09:38:30",,,,,,N,,,,,,,,,,,,,,,-1,,,,,-1,,,,-1,,,,00/00/00,00/00/00,00/00/00,,,,,,,,,,,-1,-1,-1,-1,,,,,-1,,
,6225,-1,1201,6537,N,,,1,KS562287274f20d,WC1199,,WC1199,,,,,N,,10/17/15,00/00/00,WCAB,,,,,,KS538cb2585ec51,Anaheim,"1065 N. PacifiCenter Dr.",,Anaheim,92806,AHM,Open,,,"2015-10-17 10:36:39",,,,,,N,,,,,,,,,,,,,,,-1,,,,,-1,,,,-1,,,,00/00/00,00/00/00,00/00/00,,,,,,,,,,,-1,-1,-1,-1,,,,,-1,,"2017-01-09 12:11:12"
,6231,-1,1201,6541,N,,,1,KS562eab61a1af5,WC1200,,WC1200,,,,,N,,10/26/15,00/00/00,WCAB,,,,,,KS538cb2585eeb9,Bakersfield,"1800 30th Street ","Suite 100",Bakersfield,93301,BAK,Open,,,"2015-10-26 15:38:25",2,,NG,"Nick Giszpenc",3,N,,,,,,,,,,,,,,,-1,,,,,-1,,,,-1,,,,00/00/00,00/00/00,00/00/00,,,,,,3,,,TS,"Thomas Smith",-1,-1,-1,-1,,,,,-1,,
,6232,-1,1201,6542,N,,,1,KS562eb09c6f4fb,WC1201,,WC1201,,,,,N,,10/26/15,00/00/00,WCAB,,,,,,KS538cb2585eeb9,Bakersfield,"1800 30th Street ","Suite 100",Bakersfield,93301,BAK,Open,,,"2015-10-26 16:00:44",,,,,,N,,,,,,,,,,,,,,,-1,,,,,-1,,,,-1,,,,00/00/00,00/00/00,00/00/00,,,,,,,,,,,-1,-1,-1,-1,,,,,-1,,
,6256,-1,1201,6563,N,,,1,KS56819077bcebf,WC1207,,WC1207,,,,,N,,12/28/15,00/00/00,"Personal Injury",,,,,,KS538cb2585ec51,Anaheim,"1065 N. PacifiCenter Dr.",,Anaheim,92806,AHM,Open,,,"2015-12-28 11:41:43",,,,,,N,,,,,,,,,,,,,,,-1,,,,,-1,,,,-1,,,,00/00/00,00/00/00,00/00/00,,,,,,,,,,,-1,-1,-1,-1,,,,,-1,,
,6276,-1,1201,6580,N,,,1,KS56cdd35b73273,WC1212,,WC1212,,,,,N,,02/24/16,00/00/00,WCAB,,,,,,KS538cb2585ec51,Anaheim,"1065 N. PacifiCenter Dr.",,Anaheim,92806,AHM,Open,,,"2016-02-24 07:59:23",,,,,,N,,,,,,,,,,,,,,,-1,,,,,-1,,,,-1,,,,00/00/00,00/00/00,00/00/00,,,,,,,,,,,-1,-1,-1,-1,,,,,-1,,
,6277,-1,1201,6581,N,,,1,KS56ce2a1239e74,WC1213,,WC1213,,,,,N,,02/24/16,00/00/00,WCAB,,,,,,KS538cb2585eeb9,Bakersfield,"1800 30th Street ","Suite 100",Bakersfield,93301,BAK,Open,,,"2016-02-24 14:09:22",,,,,,N,,,,,,,,,,,,,,,-1,,,,,-1,,,,-1,,,,00/00/00,00/00/00,00/00/00,,,,,,,,,,,-1,-1,-1,-1,,,,,-1,,
,6278,-1,1201,6582,N,,,1,KS56ce2a215189c,WC1214,,WC1214,,,,,N,,02/24/16,00/00/00,NewPI,,,,,,KS538cb2585eeb9,Bakersfield,"1800 30th Street ","Suite 100",Bakersfield,93301,BAK,Open,,,"2016-02-24 14:09:37",,,,,,N,,,,,,,,,,,,,,,-1,,,,,-1,,,,-1,,,,00/00/00,00/00/00,00/00/00,,,,,,,,,,,-1,-1,-1,-1,,,,,-1,,
,6391,-1,1201,6696,N,,,1,KS5735ef55f14b4,WC1223,,WC1223,,,,dogbite,N,,05/13/16,00/00/00,WCAB,Kaiser,25000.00,0,0,,KS538cb25860824,Riverside,"3737 Main Street ","Suite 300",Riverside,92501,RIV,Open,"Awaiting WCIRB Verification",,"2016-05-13 08:14:29",3,3,TS,"Thomas Smith",6,N,English,,,,,,,,,,,,,,-1,,,,,-1,,,,-1,,,,00/00/00,00/00/00,00/00/00,,,,,3,6,TS,"Thomas Smith",merc,"Mercedes Uribe",-1,-1,-1,-1,,,,,-1,,
,6438,-1,1201,6742,N,,,1,KS576458a2713a5,WC1226,,WC1226,,,,,N,,06/17/16,00/00/00,WCAB,,,,,,KS538cb2585f279,Fresno,"2550 Mariposa Mall  ","Suite 4078",Fresno,93721,FRE,Open,,,"2016-06-17 13:08:02",2,,NG,"Nick Giszpenc",3,N,,,,,,,,,,,,,,,-1,,,,,-1,,,,-1,,,,00/00/00,00/00/00,00/00/00,,,,,,3,,,TS,"Thomas Smith",-1,-1,-1,-1,,,,,-1,,
,6459,-1,1201,6762,N,,,1,KS5780f9e377724,WC1227,,WC1227,,,,carpass,N,,07/09/16,00/00/00,"Personal Injury",,,,,,KS538cb2585eeb9,Bakersfield,"1800 30th Street ","Suite 100",Bakersfield,93301,BAK,Open,,,"2016-07-09 06:19:31",2,,NG,"Nick Giszpenc",3,N,,,,,,,,,,,,,,,-1,,,,,-1,,,,-1,,,,00/00/00,00/00/00,00/00/00,,,,,,3,,,TS,"Thomas Smith",-1,-1,-1,-1,,,,,-1,,
,6499,-1,1201,6805,N,,,1,KS578fdf3433637,,PI1257,PI1257,,,,general|plaintiff,N,,07/20/16,00/00/00,employment_law,,,,,,,,,,,,,Open,,,"2016-07-20 13:29:40",,,,,,N,,,,,,,,,,,,,,,-1,,,,,-1,,,,-1,,,,00/00/00,00/00/00,00/00/00,,,,,,,,,,,-1,-1,-1,-1,,,,,-1,,
,6506,-1,1201,6812,N,,,1,KS579149499597f,,"NICK TEST",,,,,,N,,07/21/16,00/00/00,WCAB,,,,,,KS538cb2585ec51,Anaheim,"1065 N. PacifiCenter Dr.",,Anaheim,92806,AHM,Open,,,"2016-07-21 15:14:33",,,,,,N,,,,,,,,,,,,,,,-1,,,,,-1,,,,-1,,,,00/00/00,00/00/00,00/00/00,,,,,,,,,,,-1,-1,-1,-1,,,,,-1,,
,6574,-1,1201,6875,N,,,1,KS5810ff001140e,,PI1267,PI1267,,,,carpass|plaintiff,N,,10/26/16,00/00/00,NewPI,,,,,,,,,,,,,Open,,,"2016-10-26 12:07:44",,,,,,Y,Spanish,,,,,,,,,,,,,,-1,,,,,-1,,,,-1,,,,00/00/00,00/00/00,00/00/00,,,,,,,,,,,-1,-1,-1,-1,,,,,-1,,
,6643,-1,1201,6934,N,,,1,KS5845d8dcacc31,,WC1268,,,,,,N,,12/05/16,00/00/00,WCAB,,,,,,KS538cb2585eeb9,Bakersfield,"1800 30th Street ","Suite 100",Bakersfield,93301,BAK,Open,,,"2016-12-05 13:15:08",,,,,,N,,,,,,,,,,,,,,,-1,,,,,-1,,,,-1,,,,00/00/00,00/00/00,00/00/00,,,,,,,,,,,-1,-1,-1,-1,,,,,-1,,
,6659,-1,1201,6945,N,,,1,KS58937d0884479,,PI1271,PI1271,,,,general|plaintiff,N,,02/02/17,00/00/00,employment_law,,,,,,,,,,,,,Open,,,"2017-02-02 10:40:08",,,,,,N,,,,,,,,,,,,,,,-1,,,,,-1,,,,-1,,,,00/00/00,00/00/00,00/00/00,,,,,,,,,,,-1,-1,-1,-1,,,,,-1,,
,6660,-1,1201,6946,N,,,1,KS5893801e8ddf4,,PI1271,PI1271,,,,general|plaintiff,N,,02/02/17,00/00/00,employment_law,,,,,,,,,,,,,Open,,,"2017-02-02 10:53:18",,,,,,N,,,,,,,,,,,,,,,-1,,,,,-1,,,,-1,,,,00/00/00,00/00/00,00/00/00,,,,,,,,,,,-1,-1,-1,-1,,,,,-1,,
,6661,-1,1201,6947,N,,,1,KS58938ad95c54c,,PI1273,PI1273,,,,general|plaintiff,N,,02/02/17,00/00/00,employment_law,,,,,,,,,,,,,Open,,,"2017-02-02 11:39:05",,,,,,N,,,,,,,,,,,,,,,-1,,,,,-1,,,,-1,,,,00/00/00,00/00/00,00/00/00,,,,,,,,,,,-1,-1,-1,-1,,,,,-1,,
,6675,-1,1201,6960,N,,,1,KS58b0b7ba1776d,,SS1281,SS1281,,,,disability|applicant,N,,02/24/17,00/00/00,social_security,,,,,,,,,,,,,Open,,,"2017-02-24 14:46:18",,,,,,N,,,,,,,,,,,,,,,-1,,,,,-1,,,,-1,,,,00/00/00,00/00/00,00/00/00,,,,,,,,,,,-1,-1,-1,-1,,,,,-1,,
,6688,-1,1201,6973,N,,,1,KS58f64e5c56c62,,WC1285,,,,,,N,,04/18/17,00/00/00,WCAB,,,,,,,,,,,,,Open,,,"2017-04-18 10:35:24",,,,,,N,,,,,,,,,,,,,,,-1,,,,,-1,,,,-1,,,,00/00/00,00/00/00,00/00/00,,,,,,,,,,,-1,-1,-1,-1,,,,,-1,,
,6514,-1,1201,6821,N,,,1,KS57a5133e088c7,WC1263,,0,,ADJ8806648,,,N,,08/05/16,00/00/00,WCAB,,,,,,KS538cb2585ec51,Anaheim,"1065 N. PacifiCenter Dr.",,Anaheim,92806,AHM,open,,,"2016-08-05 00:00:00",,,,,,N,,9696,KA57a5133e1fd06,,ALEEM,UDDIN,"ALEEM UDDIN",,09/02/68,1968-09-02,,,,"ANAHEIM, CA 92808",55329,KP57a5133e37a1d,HARTE-HANKS,"2830 ORBITER   BREA CA 92821",,-1,,,,-1,,,,06/05/09,06/22/17,06/22/12,,"Securities and Commodities Traders","ALEEM UDDIN vs HARTE-HANKS - 06/05/09","ALEEM UDDIN vs HARTE-HANKS",,,,,,,-1,-1,-1,-1,,,,,6,,
,3496,-1,1201,3443,N,"Send all Subpoena Request to Matrix","{""suit"":"""",""jurisdiction"":"""",""case_note"":""""}",1,KS551c2e9726cc8,WC1125,WC1125,0,,Unassigned,,,N,,04/01/15,00/00/00,WCAB,NG,NG,NG,NG,,KS538cb2585ec51,Anaheim,"1065 N. PacifiCenter Dr.",,Anaheim,92806,AHM,,,,"2015-04-01 00:00:00",TS,MERC,,,NG,N,,4827,KA551c2e972fab0,,"ALEX DENG XIANG",CHEN,"ALEX DENG XIANG CHEN",,,,,,,"HACIENDA HEIGHTS, CA 91745",21297,KP551c2e973aedf,"DREAM WIRELESS INC","20625 LYCOMING ST   DIAMOND BAR CA 91789",,-1,,,,-1,,,,06/06/06,06/06/11,00/00/00,,Bakers,"ALEX DENG XIANG CHEN vs DREAM WIRELESS INC - 06/06/06","ALEX DENG XIANG CHEN vs DREAM WIRELESS INC",,,,,,,-1,-1,-1,-1,,,,,-1,,
,2985,-1,1201,3052,N,,,1,KS54b04f6b0e1b6,WC1063,,0,,Unassigned,,,N,,01/09/15,00/00/00,WCAB,1,1,1,1,3P~Y,KS538cb2585eeb9,Bakersfield,"1800 30th Street ","Suite 100",Bakersfield,93301,BAK,Active,,,"2015-01-09 14:00:11",,2,,,1,N,,4131,KS54b05bc7cca11,Mr,Angel,,"Angel Kontra",,11/23/89,1989-11-23,456123256,angel@kustomweb.com,888-888-8888,"14226 Aztec St, Sylmar, CA 91342",8171,KS54b05bea55764,"Canary Island Tats",,,-1,,,,-1,,,,02/03/13,02/03/18,00/00/00,,"Farm Labor Contractors","Angel  vs Canary Island Tats - 02/03/13",,2,1,NG,"Nick Giszpenc",av,"Angel Valero",-1,-1,-1,-1,,,,,-1,,
,2986,-1,1201,3053,N,,,1,KS54b050f26caf7,WC1064,,0,,ADJ09242015,,,N,,01/09/15,00/00/00,WCAB,,,,,,KS538cb2585fe3d,Oxnard,"1901 N. Rice Ave.","Suite 200",Oxnard,93030,OXN,Active,,,"2015-01-09 14:06:42",,2,,,1,N,,4132,KS54b05e6e6cf2b,Mr,Angel,Garica,"Angel M. Garica",,11/23/89,1989-11-23,456123256,angel@kustomweb.com,888-888-8888,"14226 Aztec St, Sylmar, CA 91342",8172,KS54b05e7f497b6,"State Comp Insurance",,,-1,,,,-1,,,,09/17/14,09/17/19,00/00/00,,,"Angel Garica vs State Comp Insurance - 09/17/14",,2,1,NG,"Nick Giszpenc",av,"Angel Valero",-1,-1,-1,-1,,,,,-1,,
,2987,-1,1201,3054,N,,,1,KS54b051e42bdae,WC1063,,0,,,,,N,,01/09/15,00/00/00,WCAB,,,,,,KS538cb2585f04d,"Eureka ","100 ""H"" Street ","Suite 202 ","Eureka ",95501,EUR,Active,,,"2015-01-09 14:10:44",,11,,,1,N,,4133,KS54b0602b96a15,Mr,Angel,,"Angel ",,,11/23/1989,456123256,angel@kustomweb.com,888-888-8888,"14226 Aztec St, Sylmar, CA 91342",8173,KS54b0603952c29,"State Comp Insurance",,,-1,,,,-1,,,,00/00/00,00/00/00,00/00/00,,,"Angel  vs State Comp Insurance - 00/00/00",,11,1,DS,"Daniel  Solver",av,"Angel Valero",-1,-1,-1,-1,,,,,-1,,
,2991,-1,1201,3058,N,,,1,KS54b0614401611,WC1068,,0,,ADJ25467,,,N,,01/09/15,00/00/00,WCAB,,,,,,KS538cb2585f04d,"Eureka ","100 ""H"" Street ","Suite 202 ","Eureka ",95501,EUR,Active,,,"2015-01-09 15:16:19",,,,,,N,,4134,KS54b0615ac1688,Mr,Angel,,"Angel ",,,11/23/1989,456123256,angel@kustomweb.com,888-888-8888,"14226 Aztec St, Sylmar, CA 91342",8176,KS54b06166ce27e,"State Comp Insurance",,,-1,,,,-1,,,,09/09/71,09/09/76,00/00/00,,"Information Security Analysts","Angel  vs State Comp Insurance - 09/09/71",,,,,,,,-1,-1,-1,-1,,,,,-1,,
,4384,-1,1201,4462,N,,,1,KS555e1c7959c37,,WC1150,0,,,,,N,,05/21/15,00/00/00,WCAB,,,,,,KS538cb2585f555,"Long Beach","300 Oceangate Street","Suite 200","Long Beach",90802,LBO,,,,"2015-05-21 00:00:00",,,,,,N,,7142,KS5568bd4051713,,angel,valeros,angel,,03/03/93,1993-03-03,123566789,,,,32271,KP555e1c7980558,"PASADENA UNIFIED SCHOOL DISTRICT","351 S HUDSON AVE   PASADENA CA 91101",,-1,,,,-1,,,,03/03/03,05/05/10,05/05/05,,"Construction Laborers","angel valeros vs PASADENA UNIFIED SCHOOL DISTRICT - 03/03/03","CY ESTABROOK vs PASADENA UNIFIED SCHOOL DISTRICT",,,,,,,-1,-1,-1,-1,,,,,2,,
,4665,-1,1201,4787,N,,,1,KS5567731dd569b,WC1152,,0,,,,,N,,05/28/15,00/00/00,"Personal Injury",TS,TS,TS,TS,,KS538cb2585eeb9,Bakersfield,"1800 30th Street ","Suite 100",Bakersfield,93301,BAK,Active,"Fees Paid",MSC,"2015-05-28 12:57:17",,8,,,TS,N,,7076,KS55678ec530fa3,Mr,Angel,,"Angel ",,,11/23/1989,456123256,angel@kustomweb.com,888-888-8888,"14226 Aztec St, Sylmar, CA 91342",-1,,,,,-1,,,,-1,,,,00/00/00,00/00/00,00/00/00,,,"Angel  vs  - 00/00/00","Terry vs Mary",8,,av,"arturo valero",,,-1,-1,-1,-1,,,,,-1,,
,4672,-1,1201,4799,N,,,1,KS55678a082d435,WC1153,,0,,,,,N,,05/28/15,00/00/00,"Personal Injury",,,,,,KS538cb2585eeb9,Bakersfield,"1800 30th Street ","Suite 100",Bakersfield,93301,BAK,Active,,,"2015-05-28 14:35:04",1,8,av,"Angel Valero",2,N,,7073,KS55678e6c33a27,Mr,Angel,,"Angel ",,,11/23/1989,456123256,angel@kustomweb.com,888-888-8888,"14226 Aztec St, Sylmar, CA 91342",-1,,,,,-1,,,,-1,,,,00/00/00,00/00/00,00/00/00,,,"Angel  vs  - 00/00/00",,8,2,av,"arturo valero",NG,"Nick Giszpenc",-1,-1,-1,-1,,,,,-1,,
,4673,-1,1201,4800,N,,,1,KS55678a659b9f8,WC1154,,0,,,,,N,,05/28/15,00/00/00,"Personal Injury",,,,,,KS538cb2585eeb9,Bakersfield,"1800 30th Street ","Suite 100",Bakersfield,93301,BAK,Active,,,"2015-05-28 14:36:37",1,8,av,"Angel Valero",2,N,,7072,KS55678a754f60e,Mr,Angel,,"Angel ",,11/23/89,1989-11-23,456123256,angel@kustomweb.com,888-888-8888,"14226 Aztec St, Sylmar, CA 91342",-1,,,,,36969,KS5568c03bca2d2,ovoxo,"12000 Paxton St, Los Angeles, CA 91342",-1,,,,00/00/00,00/00/00,00/00/00,,,"Angel  vs  - 00/00/00",,8,2,av,"arturo valero",NG,"Nick Giszpenc",-1,-1,-1,-1,,,,,-1,,
,4673,-1,1201,4800,N,,,1,KS55678a659b9f8,WC1154,,0,,,,,N,,05/28/15,00/00/00,"Personal Injury",,,,,,KS538cb2585eeb9,Bakersfield,"1800 30th Street ","Suite 100",Bakersfield,93301,BAK,Active,,,"2015-05-28 14:36:37",1,8,av,"Angel Valero",2,N,,7072,KS55678a754f60e,Mr,Angel,,"Angel ",,11/23/89,1989-11-23,456123256,angel@kustomweb.com,888-888-8888,"14226 Aztec St, Sylmar, CA 91342",-1,,,,,36970,KS5568c64fcc581,ovoxo,"12000 Paxton St, Los Angeles, CA 91342",-1,,,,00/00/00,00/00/00,00/00/00,,,"Angel  vs  - 00/00/00",,8,2,av,"arturo valero",NG,"Nick Giszpenc",-1,-1,-1,-1,,,,,-1,,
,4673,-1,1201,4800,N,,,1,KS55678a659b9f8,WC1154,,0,,,,,N,,05/28/15,00/00/00,"Personal Injury",,,,,,KS538cb2585eeb9,Bakersfield,"1800 30th Street ","Suite 100",Bakersfield,93301,BAK,Active,,,"2015-05-28 14:36:37",1,8,av,"Angel Valero",2,N,,7072,KS55678a754f60e,Mr,Angel,,"Angel ",,11/23/89,1989-11-23,456123256,angel@kustomweb.com,888-888-8888,"14226 Aztec St, Sylmar, CA 91342",-1,,,,,36971,KS5568cf271e795,ovoxo,"12000 Paxton St, Los Angeles, CA 91342",-1,,,,00/00/00,00/00/00,00/00/00,,,"Angel  vs  - 00/00/00",,8,2,av,"arturo valero",NG,"Nick Giszpenc",-1,-1,-1,-1,,,,,-1,,
,4673,-1,1201,4800,N,,,1,KS55678a659b9f8,WC1154,,0,,,,,N,,05/28/15,00/00/00,"Personal Injury",,,,,,KS538cb2585eeb9,Bakersfield,"1800 30th Street ","Suite 100",Bakersfield,93301,BAK,Active,,,"2015-05-28 14:36:37",1,8,av,"Angel Valero",2,N,,7072,KS55678a754f60e,Mr,Angel,,"Angel ",,11/23/89,1989-11-23,456123256,angel@kustomweb.com,888-888-8888,"14226 Aztec St, Sylmar, CA 91342",-1,,,,,36972,KS5568d07099498,ovoxo,"12000 Paxton St, Los Angeles, CA 91342",-1,,,,00/00/00,00/00/00,00/00/00,,,"Angel  vs  - 00/00/00",,8,2,av,"arturo valero",NG,"Nick Giszpenc",-1,-1,-1,-1,,,,,-1,,
,4673,-1,1201,4800,N,,,1,KS55678a659b9f8,WC1154,,0,,,,,N,,05/28/15,00/00/00,"Personal Injury",,,,,,KS538cb2585eeb9,Bakersfield,"1800 30th Street ","Suite 100",Bakersfield,93301,BAK,Active,,,"2015-05-28 14:36:37",1,8,av,"Angel Valero",2,N,,7072,KS55678a754f60e,Mr,Angel,,"Angel ",,11/23/89,1989-11-23,456123256,angel@kustomweb.com,888-888-8888,"14226 Aztec St, Sylmar, CA 91342",-1,,,,,36973,KS5568d22f0e348,ovoxo,"12000 Paxton St, Los Angeles, CA 91342",-1,,,,00/00/00,00/00/00,00/00/00,,,"Angel  vs  - 00/00/00",,8,2,av,"arturo valero",NG,"Nick Giszpenc",-1,-1,-1,-1,,,,,-1,,
,4673,-1,1201,4800,N,,,1,KS55678a659b9f8,WC1154,,0,,,,,N,,05/28/15,00/00/00,"Personal Injury",,,,,,KS538cb2585eeb9,Bakersfield,"1800 30th Street ","Suite 100",Bakersfield,93301,BAK,Active,,,"2015-05-28 14:36:37",1,8,av,"Angel Valero",2,N,,7072,KS55678a754f60e,Mr,Angel,,"Angel ",,11/23/89,1989-11-23,456123256,angel@kustomweb.com,888-888-8888,"14226 Aztec St, Sylmar, CA 91342",-1,,,,,36974,KS5568d24da94d3,ovoxo,"12000 Paxton St, Los Angeles, CA 91342",-1,,,,00/00/00,00/00/00,00/00/00,,,"Angel  vs  - 00/00/00",,8,2,av,"arturo valero",NG,"Nick Giszpenc",-1,-1,-1,-1,,,,,-1,,
,4673,-1,1201,4800,N,,,1,KS55678a659b9f8,WC1154,,0,,,,,N,,05/28/15,00/00/00,"Personal Injury",,,,,,KS538cb2585eeb9,Bakersfield,"1800 30th Street ","Suite 100",Bakersfield,93301,BAK,Active,,,"2015-05-28 14:36:37",1,8,av,"Angel Valero",2,N,,7072,KS55678a754f60e,Mr,Angel,,"Angel ",,11/23/89,1989-11-23,456123256,angel@kustomweb.com,888-888-8888,"14226 Aztec St, Sylmar, CA 91342",-1,,,,,36975,KS5568d2e89d0c1,ovoxo,"12000 Paxton St, Los Angeles, CA 91342",-1,,,,00/00/00,00/00/00,00/00/00,,,"Angel  vs  - 00/00/00",,8,2,av,"arturo valero",NG,"Nick Giszpenc",-1,-1,-1,-1,,,,,-1,,
,4673,-1,1201,4800,N,,,1,KS55678a659b9f8,WC1154,,0,,,,,N,,05/28/15,00/00/00,"Personal Injury",,,,,,KS538cb2585eeb9,Bakersfield,"1800 30th Street ","Suite 100",Bakersfield,93301,BAK,Active,,,"2015-05-28 14:36:37",1,8,av,"Angel Valero",2,N,,7072,KS55678a754f60e,Mr,Angel,,"Angel ",,11/23/89,1989-11-23,456123256,angel@kustomweb.com,888-888-8888,"14226 Aztec St, Sylmar, CA 91342",-1,,,,,36976,KS5568d5f609ca1,ovoxo,"12000 Paxton St, Los Angeles, CA 91342",-1,,,,00/00/00,00/00/00,00/00/00,,,"Angel  vs  - 00/00/00",,8,2,av,"arturo valero",NG,"Nick Giszpenc",-1,-1,-1,-1,,,,,-1,,
,4673,-1,1201,4800,N,,,1,KS55678a659b9f8,WC1154,,0,,,,,N,,05/28/15,00/00/00,"Personal Injury",,,,,,KS538cb2585eeb9,Bakersfield,"1800 30th Street ","Suite 100",Bakersfield,93301,BAK,Active,,,"2015-05-28 14:36:37",1,8,av,"Angel Valero",2,N,,7072,KS55678a754f60e,Mr,Angel,,"Angel ",,11/23/89,1989-11-23,456123256,angel@kustomweb.com,888-888-8888,"14226 Aztec St, Sylmar, CA 91342",-1,,,,,36977,KS5568d8360a6d1,ovoxo,"12000 Paxton St, Los Angeles, CA 91342",-1,,,,00/00/00,00/00/00,00/00/00,,,"Angel  vs  - 00/00/00",,8,2,av,"arturo valero",NG,"Nick Giszpenc",-1,-1,-1,-1,,,,,-1,,
,4673,-1,1201,4800,N,,,1,KS55678a659b9f8,WC1154,,0,,,,,N,,05/28/15,00/00/00,"Personal Injury",,,,,,KS538cb2585eeb9,Bakersfield,"1800 30th Street ","Suite 100",Bakersfield,93301,BAK,Active,,,"2015-05-28 14:36:37",1,8,av,"Angel Valero",2,N,,7072,KS55678a754f60e,Mr,Angel,,"Angel ",,11/23/89,1989-11-23,456123256,angel@kustomweb.com,888-888-8888,"14226 Aztec St, Sylmar, CA 91342",-1,,,,,36978,KS5568d93ca252a,ovoxo,"12000 Paxton St, Los Angeles, CA 91342",-1,,,,00/00/00,00/00/00,00/00/00,,,"Angel  vs  - 00/00/00",,8,2,av,"arturo valero",NG,"Nick Giszpenc",-1,-1,-1,-1,,,,,-1,,
,4673,-1,1201,4800,N,,,1,KS55678a659b9f8,WC1154,,0,,,,,N,,05/28/15,00/00/00,"Personal Injury",,,,,,KS538cb2585eeb9,Bakersfield,"1800 30th Street ","Suite 100",Bakersfield,93301,BAK,Active,,,"2015-05-28 14:36:37",1,8,av,"Angel Valero",2,N,,7072,KS55678a754f60e,Mr,Angel,,"Angel ",,11/23/89,1989-11-23,456123256,angel@kustomweb.com,888-888-8888,"14226 Aztec St, Sylmar, CA 91342",-1,,,,,36979,KS5568d9e89c466,ovoxo,"12000 Paxton St, Los Angeles, CA 91342",-1,,,,00/00/00,00/00/00,00/00/00,,,"Angel  vs  - 00/00/00",,8,2,av,"arturo valero",NG,"Nick Giszpenc",-1,-1,-1,-1,,,,,-1,,
,4673,-1,1201,4800,N,,,1,KS55678a659b9f8,WC1154,,0,,,,,N,,05/28/15,00/00/00,"Personal Injury",,,,,,KS538cb2585eeb9,Bakersfield,"1800 30th Street ","Suite 100",Bakersfield,93301,BAK,Active,,,"2015-05-28 14:36:37",1,8,av,"Angel Valero",2,N,,7072,KS55678a754f60e,Mr,Angel,,"Angel ",,11/23/89,1989-11-23,456123256,angel@kustomweb.com,888-888-8888,"14226 Aztec St, Sylmar, CA 91342",-1,,,,,36980,KS5568da7057b46,ovoxo,"12000 Paxton St, Los Angeles, CA 91342",-1,,,,00/00/00,00/00/00,00/00/00,,,"Angel  vs  - 00/00/00",,8,2,av,"arturo valero",NG,"Nick Giszpenc",-1,-1,-1,-1,,,,,-1,,
,4673,-1,1201,4800,N,,,1,KS55678a659b9f8,WC1154,,0,,,,,N,,05/28/15,00/00/00,"Personal Injury",,,,,,KS538cb2585eeb9,Bakersfield,"1800 30th Street ","Suite 100",Bakersfield,93301,BAK,Active,,,"2015-05-28 14:36:37",1,8,av,"Angel Valero",2,N,,7072,KS55678a754f60e,Mr,Angel,,"Angel ",,11/23/89,1989-11-23,456123256,angel@kustomweb.com,888-888-8888,"14226 Aztec St, Sylmar, CA 91342",-1,,,,,38245,KS556e167b73537,ovoxo,"12000 Paxton St, Los Angeles, CA 91342",-1,,,,00/00/00,00/00/00,00/00/00,,,"Angel  vs  - 00/00/00",,8,2,av,"arturo valero",NG,"Nick Giszpenc",-1,-1,-1,-1,,,,,-1,,
,5908,-1,1201,6224,N,,,1,KS55ba941c4d871,WC1173,,0,,,,,N,,07/30/15,00/00/00,WCAB,,,,,,KS538cb2585f04d,"Eureka ","100 ""H"" Street ","Suite 202 ","Eureka ",95501,EUR,,,,"2015-07-30 14:16:12",,,,,,N,,9264,KS55ba9435bb90c,Mr,Angel,Angel,"Angel ",,,11/23/1989,456123256,angel@kustomweb.com,888-888-8888,"14226 Aztec St, Sylmar, CA 91342",-1,,,,,-1,,,,-1,,,,00/00/00,00/00/00,00/00/00,,,"Angel Angel vs  - 00/00/00",,,,,,,,-1,-1,-1,-1,,,,,-1,,"2015-12-03 11:25:39"
,6253,-1,1201,6560,N,,,1,KS5667331453191,WC1206,,WC1206,,,,,N,,12/08/15,00/00/00,NewPI,,,,,,KS538cb2585eeb9,Bakersfield,"1800 30th Street ","Suite 100",Bakersfield,93301,BAK,Open,,,"2015-12-08 11:44:20",2,3,NG,"Nick Giszpenc",,N,English,9651,KS566733ed7de6d,Mr,angel,guy,"angel guy",English,,10/24/1989,555555555,thisguy@gmail.com,818-565-5656,"3245 Wilshire Boulevard, Los Angeles, CA 90010",-1,,,,,52968,KS56673451d0d65,someplace,"2340 North Hollywood Way, Burbank, CA 91505",-1,,,,00/00/00,00/00/00,00/00/00,,,"angel guy vs  - 00/00/00",,3,,TS,"Thomas Smith",,,-1,-1,-1,-1,,,,,-1,,
,6253,-1,1201,6560,N,,,1,KS5667331453191,WC1206,,WC1206,,,,,N,,12/08/15,00/00/00,NewPI,,,,,,KS538cb2585eeb9,Bakersfield,"1800 30th Street ","Suite 100",Bakersfield,93301,BAK,Open,,,"2015-12-08 11:44:20",2,3,NG,"Nick Giszpenc",,N,English,9651,KS566733ed7de6d,Mr,angel,guy,"angel guy",English,,10/24/1989,555555555,thisguy@gmail.com,818-565-5656,"3245 Wilshire Boulevard, Los Angeles, CA 90010",-1,,,,,53035,KS56a172468fbf8,someplace,"2340 North Hollywood Way, Burbank, CA 91505",-1,,,,00/00/00,00/00/00,00/00/00,,,"angel guy vs  - 00/00/00",,3,,TS,"Thomas Smith",,,-1,-1,-1,-1,,,,,-1,,
,6261,-1,1201,6567,N,,,1,KS56a170fb52c77,WC1208,,WC1208,,,,,N,,01/21/16,00/00/00,NewPI,,,,,,KS538cb2585eeb9,Bakersfield,"1800 30th Street ","Suite 100",Bakersfield,93301,BAK,Open,,,"2016-01-21 15:59:55",,,,,,N,,9652,KS56a17105eef5a,Mr,angel,guy,"angel guy",English,,10/24/1989,555555555,thisguy@gmail.com,818-565-5656,"3245 Wilshire Boulevard, Los Angeles, CA 90010",-1,,,,,53034,KS56a171940f066,someone,,-1,,,,00/00/00,00/00/00,00/00/00,,,"angel guy vs  - 00/00/00",,,,,,,,-1,-1,-1,-1,,,,,-1,,
,6267,-1,1201,6572,N,,,1,KS56b10b054235f,WC1210,,WC1210,,,,,N,,02/02/16,00/00/00,NewPI,,,,,,KS538cb2585eeb9,Bakersfield,"1800 30th Street ","Suite 100",Bakersfield,93301,BAK,Open,,,"2016-02-02 12:01:09",,,,,,N,,9657,KS56b10b8549cb6,Mr,angel,guy,"angel guy",English,,10/24/1989,555555555,thisguy@gmail.com,818-565-5656,"3245 Wilshire Boulevard, Los Angeles, CA 90010",-1,,,,,53072,KS56b10bd1b086c,"tommy inc","4502 Nordhoff Street, Los Angeles, CA 91402",-1,,,,00/00/00,00/00/00,00/00/00,,,"angel guy vs  - 00/00/00",,,,,,,,-1,-1,-1,-1,,,,,-1,,
,6300,-1,1201,6605,N,,,1,KS56fc5aa461320,WC1219,,WC1219,,,,carpass,N,,03/30/16,00/00/00,NewPI,,,,,,KS538cb258605b7,Redding,"2115 Civic Center Drive","Suite 15",Redding,96001,RDG,Open,,,"2016-03-30 16:00:52",,,,,,N,,9662,KS56fc5aabad1dd,Mr,angel,guy,"angel guy",English,,10/24/1989,555555555,thisguy@gmail.com,818-565-5656,"3245 Wilshire Boulevard, Los Angeles, CA 90010",-1,,,,,53345,KS56fc5ab2597b5,someplace,"2340 North Hollywood Way, Burbank, CA 91505",-1,,,,00/00/00,00/00/00,00/00/00,,,"angel guy vs  - 00/00/00",,,,,,,,-1,-1,-1,-1,,,,,-1,,
,6301,-1,1201,6606,N,,,1,KS56fc5c35205f6,WC1220,,WC1220,,,,carpass,N,,03/30/16,00/00/00,NewPI,,,,,,KS538cb2585eeb9,Bakersfield,"1800 30th Street ","Suite 100",Bakersfield,93301,BAK,Open,,,"2016-03-30 16:07:33",,,,,,N,,9663,KS56fc5c3c2f4d1,Mr,angel,guy,"angel guy",English,,10/24/1989,555555555,thisguy@gmail.com,818-565-5656,"3245 Wilshire Boulevard, Los Angeles, CA 90010",-1,,,,,53347,KS56fc5c44d32d0,someplace,"2340 North Hollywood Way, Burbank, CA 91505",-1,,,,00/00/00,00/00/00,00/00/00,,,"angel guy vs  - 00/00/00","angel guy vs someplace",,,,,,,-1,-1,-1,-1,,,,,-1,,
,6301,-1,1201,6606,N,,,1,KS56fc5c35205f6,WC1220,,WC1220,,,,carpass,N,,03/30/16,00/00/00,NewPI,,,,,,KS538cb2585eeb9,Bakersfield,"1800 30th Street ","Suite 100",Bakersfield,93301,BAK,Open,,,"2016-03-30 16:07:33",,,,,,N,,9663,KS56fc5c3c2f4d1,Mr,angel,guy,"angel guy",English,,10/24/1989,555555555,thisguy@gmail.com,818-565-5656,"3245 Wilshire Boulevard, Los Angeles, CA 90010",-1,,,,,53778,KS570d7f654c0c4,"brand new comapny","15403 Sherman Way, Los Angeles, CA 91406",-1,,,,00/00/00,00/00/00,00/00/00,,,"angel guy vs  - 00/00/00","angel guy vs someplace",,,,,,,-1,-1,-1,-1,,,,,-1,,
,6465,-1,1201,6768,N,,,1,KS57853f7b499f7,WC1228,,WC1228,,,,carpass,N,,07/12/16,00/00/00,NewPI,,,,,,KS538cb2585eeb9,Bakersfield,"1800 30th Street ","Suite 100",Bakersfield,93301,BAK,Open,,,"2016-07-12 12:05:31",,,,,,N,,9672,KS57853fcb2e814,,Angel,New,"Angel New",,,11/12/1991,444444444,me@site.com,454-545-4545,"15643 Sherman Way, Los Angeles, CA 91406",-1,,,,,55096,KS578540452767c,WWE,"12323 Sherman Way, Los Angeles, CA 91605",-1,,,,00/00/00,00/00/00,00/00/00,,,"Angel New vs  - 00/00/00",,,,,,,,-1,-1,-1,-1,,,,,-1,"2016-07-22 18:00:00",
,6477,-1,1201,6783,N,,,1,KS578d278c47faa,WC1236,,WC1236,,,,general,N,,07/18/16,00/00/00,employment_law,,,,,,KS538cb2585eeb9,Bakersfield,"1800 30th Street ","Suite 100",Bakersfield,93301,BAK,Open,,,"2016-07-18 12:01:32",,,,,,N,,9686,KS578d28bb4d8e3,Mr,barturo,lavender,"barturo lavender",,,10/16/1981,444444444,email@sitio.mx,222-222-2222,"213 Glenoaks Boulevard, San Fernando, CA 91340",-1,,,,,55183,KS578d290dd5c38,spalding,"454S South Rossmore Avenue, Los Angeles, CA 90020",-1,,,,00/00/00,00/00/00,00/00/00,,,"barturo lavender vs  - 00/00/00",,,,,,,,-1,-1,-1,-1,,,,,-1,,
,6212,-1,1201,6527,N,,,1,KS561fac32ecede,WC1196,,0,,ADJ9170488,,,N,,10/15/15,00/00/00,WCAB,,,,,,KS538cb2585ec51,Anaheim,"1065 N. PacifiCenter Dr.",,Anaheim,92806,AHM,Open,,,"2015-10-15 06:37:54",,,,,,N,,9641,KS561fac46c7a03,,Berry,Green,"Berry Green",,11/11/61,1961-11-11,,,,,52689,KS561fac635aff9,"LOS COUNTY SHERIFFS DEPARTMENT","441 BAUCHET ST.   LOS ANGELES CA 90012",,-1,,,,-1,,,,10/09/13,10/09/18,00/00/00,,,"Berry Green vs LOS COUNTY SHERIFFS DEPARTMENT - 10/09/13",,,,,,,,-1,-1,-1,-1,,,,,9,,
,2996,-1,1201,3062,N,,,1,KS54b6ced4a73d9,WC1070,,0,,Unassigned,,,N,,01/14/15,00/00/00,WCAB,1,1,1,1,,KS538cb2585eeb9,Bakersfield,"1800 30th Street ","Suite 100",Bakersfield,93301,BAK,Active,,,"2015-01-14 12:17:24",,384,,,1,N,,4142,KS54b6cf5f153d4,,Bob,Smith,"Bob Smith",,,,,,,"4508 Tobias Avenue, Sherman Oaks, CA 91403",8206,KS54b6cf6be74f5,"Star Labs","1345 San Fernando Rd, San Fernando, CA 91340",,50837,KS55d6241c72069,hhhhaaaa,,-1,,,,05/05/05,05/05/10,00/00/00,,"Bus and Truck Mechanics and Diesel Engine Specialists","Bob Smith vs Star Labs - 05/05/05",,384,1,JR,"John  Ramirez",av,"Angel Valero",6,-1,-1,-1,,,,,-1,,
,3290,-1,1201,3271,N,"This is your creation",,1,KS54ec0ab6aa69b,,WC1093,0,,Unassigned,,,N,,02/23/15,00/00/00,WCAB,,,,,,KS538cb2585eeb9,Bakersfield,"1800 30th Street ","Suite 100",Bakersfield,93301,BAK,Active,,,"2015-02-23 21:23:02",,,,,,N,,4548,KS54ec0acd1b9a3,Mr,,,"Bob Smithies",,03/03/63,1963-03-03,,,,"4508 Tobias Avenue, Los Angeles, CA 91403",9868,KS54ec0ad60ac8a,"Bennett Industries",,,-1,,,,-1,,,,02/05/02,02/05/07,00/00/00,,"Painters, Construction and Maintenance","  vs Bennett Industries - 02/05/02",,,,,,,,4,22,1,-1,,,,,-1,,
,3290,-1,1201,3271,N,"This is your creation",,1,KS54ec0ab6aa69b,,WC1093,0,,Unassigned,,,N,,02/23/15,00/00/00,WCAB,,,,,,KS538cb2585eeb9,Bakersfield,"1800 30th Street ","Suite 100",Bakersfield,93301,BAK,Active,,,"2015-02-23 21:23:02",,,,,,N,,4548,KS54ec0acd1b9a3,Mr,,,"Bob Smithies",,03/03/63,1963-03-03,,,,"4508 Tobias Avenue, Los Angeles, CA 91403",9868,KS54ec0ad60ac8a,"Bennett Industries",,,-1,,,,-1,,,,02/05/02,02/05/07,00/00/00,,"Painters, Construction and Maintenance","  vs Bennett Industries - 02/05/02",,,,,,,,4,21,1,-1,,,,,-1,,
,3624,-1,1201,3271,N,"This is your creation",,2,KS54ec0ab6aa69b,,WC1093,0,,Unassigned,,,N,,02/23/15,00/00/00,WCAB,,,,,,KS538cb2585eeb9,Bakersfield,"1800 30th Street ","Suite 100",Bakersfield,93301,BAK,Active,,,"2015-02-23 21:23:02",,,,,,N,,4548,KS54ec0acd1b9a3,Mr,,,"Bob Smithies",,03/03/63,1963-03-03,,,,"4508 Tobias Avenue, Los Angeles, CA 91403",9868,KS54ec0ad60ac8a,"Bennett Industries",,,-1,,,,-1,,,,12/13/03,12/31/08,12/31/03,,"Labor Relations Specialists","  vs Bennett Industries - 12/13/03",,,,,,,,-1,-1,1,-1,,,,,-1,,
,6520,-1,1201,3271,N,"This is your creation",,3,KS54ec0ab6aa69b,,WC1093,0,,Unassigned,,,N,,02/23/15,00/00/00,WCAB,,,,,,KS538cb2585eeb9,Bakersfield,"1800 30th Street ","Suite 100",Bakersfield,93301,BAK,Active,,,"2015-02-23 21:23:02",,,,,,N,,4548,KS54ec0acd1b9a3,Mr,,,"Bob Smithies",,03/03/63,1963-03-03,,,,"4508 Tobias Avenue, Los Angeles, CA 91403",9868,KS54ec0ad60ac8a,"Bennett Industries",,,-1,,,,-1,,,,03/03/05,03/03/10,00/00/00,,"Mathematical Science Occupations, All Other","  vs Bennett Industries - 03/03/05",,,,,,,,-1,-1,-1,-1,,,,,-1,,
,6521,-1,1201,3271,N,"This is your creation",,4,KS54ec0ab6aa69b,,WC1093,0,,Unassigned,,,N,,02/23/15,00/00/00,WCAB,,,,,,KS538cb2585eeb9,Bakersfield,"1800 30th Street ","Suite 100",Bakersfield,93301,BAK,Active,,,"2015-02-23 21:23:02",,,,,,N,,4548,KS54ec0acd1b9a3,Mr,,,"Bob Smithies",,03/03/63,1963-03-03,,,,"4508 Tobias Avenue, Los Angeles, CA 91403",9868,KS54ec0ad60ac8a,"Bennett Industries",,,-1,,,,-1,,,,05/05/08,05/05/13,00/00/00,,"Heavy and Tractor-Trailer Truck Drivers","  vs Bennett Industries - 05/05/08",,,,,,,,-1,-1,-1,-1,,,,,-1,,
,5893,-1,1201,6211,N,,,1,KS55ba1be79c681,WC1163,,0,,,,,N,,07/30/15,00/00/00,WCAB,,,,,,KS538cb2585eeb9,Bakersfield,"1800 30th Street ","Suite 100",Bakersfield,93301,BAK,Active,"Fees Pending",,"2015-07-30 05:43:19",,3,,,2,N,,9245,KS55ba1c0fc91be,Mr,Carl,Johoson,"Carl Johoson",,06/02/45,1945-06-02,627155608,,,"231 N Mountain Ave, Ontario, CA 91762",50253,KS55ba1c2543dfc,"Accent ","30917 Prairie Sun Way, Murrieta, CA 92563",,-1,,,,-1,,,,03/03/03,03/03/08,00/00/00,,"Fish and Game Wardens","Carl Johoson vs Accent  - 03/03/03",,3,2,TS,"Thomas Smith",NG,"Nick Giszpenc",-1,-1,-1,-1,,,,,3,,
,4404,-1,1201,4484,N,,,1,KS555e315b180d9,WC1151,,0,,ADJ2847248,,,N,,05/21/15,00/00/00,WCAB,,,,,,,,,,,,,open,,,"2015-05-21 00:00:00",,,,,,N,,6544,KA555e315b26869,,CY,ESTABROOK,"CY ESTABROOK",,,,,,,"PASADENA, CA 91103",32512,KP555e315b34b3c,"PASADENA UNIFIED SCHOOL DISTRICT","351 S HUDSON AVE   PASADENA CA 91101",,-1,,,,-1,,,,01/15/04,01/15/09,00/00/00,,,"CY ESTABROOK vs PASADENA UNIFIED SCHOOL DISTRICT - 01/15/04","CY ESTABROOK vs PASADENA UNIFIED SCHOOL DISTRICT",,,,,,,-1,-1,-1,-1,,,,,-1,,
,5949,-1,1201,6266,N,,,1,KS55c3924e5f7f2,WC1183,,0,,"ADJ9499326 ",,,N,,08/06/15,00/00/00,WCAB,,,,,,KS538cb258605b7,Redding,"2115 Civic Center Drive","Suite 15",Redding,96001,RDG,open,,,"2015-08-06 00:00:00",,,,,,N,,9339,KA55c3924e67738,,DANIELLE,JOHNSON,"DANIELLE JOHNSON",,,,,,,"MARYSVILLE, CA 95901",50730,KP55c3924e7029d,"BIANICHI ORCHARD SYSTEMS","988 EVANS REIMER RD   GRIDLEY CA 95948",,-1,,,,-1,,,,08/14/12,08/14/17,00/00/00,,,"DANIELLE JOHNSON vs BIANICHI ORCHARD SYSTEMS - 08/14/12","DANIELLE JOHNSON vs BIANICHI ORCHARD SYSTEMS",,,,,,,-1,-1,-1,-1,,,,,7,,"2017-01-09 09:53:57"
,3639,-1,1201,3570,N,,,1,KS553a844f21459,WC1002,,0,,ADJ8748364,,,N,,04/24/15,00/00/00,WCAB,,,,,,,,,,,,,open,,,"2015-04-24 00:00:00",,,,,,N,,5066,KA553a844f35b00,,DIANE,FREEMAN,"DIANE FREEMAN",,,,,,,"COMPTON, CA 90221",22597,KP553a844f4364e,"MV TRANSPORTATION","12222 WILMINGTON AVE   CARSON CA 90810",,-1,,,,-1,,,,06/25/98,01/28/18,01/28/13,,,"DIANE FREEMAN vs MV TRANSPORTATION - 06/25/98","DIANE FREEMAN vs MV TRANSPORTATION",,,,,,,-1,-1,-1,-1,,,,,-1,,
,6280,-1,1201,6586,N,,,1,KS56e72032a0d3d,WC1217,,0,,,,,N,,03/14/16,00/00/00,WCAB,,,,,,KS538cb2585eeb9,Bakersfield,"1800 30th Street ","Suite 100",Bakersfield,93301,BAK,open,,,"2016-03-14 00:00:00",,,,,,N,,9659,KA56e72032b225b,,ERICK,VALDES,"ERICK VALDES",,,,,,,"CALIFORNIA CITY, CA 93505",53170,KP56e72032be721,"NATURA PEST CONTROL","3220 W MONTE VISTA AVE SUITE 282   TURLOCK CA 95380",,-1,,,,-1,,,,00/00/00,00/00/00,00/00/00,,,"ERICK VALDES vs NATURA PEST CONTROL - 00/00/00","ERICK VALDES vs NATURA PEST CONTROL",,,,,,,-1,-1,-1,-1,,,,,-1,,"2017-04-07 10:00:10"
,6689,-1,1201,6974,N,,"{""suit"":"""",""jurisdiction"":"""",""case_note"":""""}",1,KS58f67fc3e87c5,WC1286,WC1286,ADJ2308742,,Unassigned,,,Y,,04/18/17,00/00/00,WCAB,TM,TM,TM,TM,,KS538cb25860824,Riverside,"3737 Main Street ","Suite 300",Riverside,92501,RIV,Open,"Awaiting WCIRB Verification",,"2017-04-18 14:06:11",TS,TS,,,TM,N,,9722,KS58f692b239d87,Ms,Erin,Greendale,"Erin Greendale",English,,09/01/1946,571000052,Erin@mccraneycompany.com,951-422-4301,"1819 Garland Street, Westmont, CA 91766",56741,KS58f693c70824b,"Safe Rode inc",,,-1,,,,-1,,,,04/11/17,04/15/19,00/00/00,,,"Erin Greendale vs Safe Rode inc - 04/11/17",,,,,,,,-1,-1,-1,-1,,,,,-1,,
,6645,-1,1201,6936,N,,,1,KS58502467a954b,WC1270,,0,,ADJ6942006,,,N,,12/13/16,00/00/00,WCAB,,,,,,KS538cb2585f9c2,"Marina del Rey","4720 Lincoln Blvd ","2nd floor","Marina del Rey",90292,MDR,open,,,"2016-12-13 00:00:00",,,,,,N,,9710,KA58502467bc15a,,GUSTAVO,MORENO,"GUSTAVO MORENO",,,,,,,"DOWNEY, CA 90242",56352,KP58502467d7a6c,"LITTLE JOHNS BODYWORKS INC","9634 E FIRESTONE BLVD   DOWNEY CA 90241",,-1,,,,-1,,,,01/22/09,01/22/14,00/00/00,,,"GUSTAVO MORENO vs LITTLE JOHNS BODYWORKS INC - 01/22/09","GUSTAVO MORENO vs LITTLE JOHNS BODYWORKS INC",,,,,,,-1,-1,-1,-1,,,,,-1,,
,6421,-1,1201,6726,N,,,1,KS5757149858b76,WC1225,,0,,ADJ8049127,,,N,,06/07/16,00/00/00,WCAB,,,,,,KS538cb2585f9c2,"Marina del Rey","4720 Lincoln Blvd ","2nd floor","Marina del Rey",90292,MDR,open,,,"2016-06-07 00:00:00",,,,,,N,,9670,KA5757149864043,,HORACIO,GARCIA,"HORACIO GARCIA",,,,,,,"WILMINGTON, CA 90744",54642,KP575714986e4df,"ARIANA WORLDWIDE INC","131 EAST GARDENA BOULEVARD   GARDENA CA 90247",,-1,,,,-1,,,,09/28/11,09/28/16,00/00/00,,,"HORACIO GARCIA vs ARIANA WORLDWIDE INC - 09/28/11","HORACIO GARCIA vs ARIANA WORLDWIDE INC",,,,,,,-1,-1,-1,-1,,,,,-1,,
,6341,-1,1201,6646,N,,,1,KS570d43bcc342d,WC1222,,0,,ADJ8836579,,,N,,04/12/16,00/00/00,WCAB,,,,,,KS538cb2585f792,"Los Angeles","320 W. 4th Street ","9th floor","Los Angeles",90013,LAO,open,,,"2016-04-12 00:00:00",,,,,,N,,9666,KA570d43bcd5bd7,,IGNACIO,HERNANDEZ,"IGNACIO HERNANDEZ",,,,,,,"NORTH HILLS, CA 91343",53773,KP570d43bce5123,"TWO LADIES AND A BROOM","21704 DEVENSHIRE ST STE 314   CHATSWORTH CA 91311",,-1,,,,-1,,,,01/19/12,01/19/18,01/19/13,,,"IGNACIO HERNANDEZ vs TWO LADIES AND A BROOM - 01/19/12","IGNACIO HERNANDEZ vs TWO LADIES AND A BROOM",,,,,,,-1,-1,-1,-1,,,,,-1,,
,3371,-1,1201,3327,N,,,1,KS55074a71d7975,WC1099,,0,,,,,N,,03/16/15,00/00/00,WCAB,,,,,,KS538cb2585f555,"Long Beach","300 Oceangate Street","Suite 200","Long Beach",90802,LBO,,,,"2015-03-16 14:26:09",,,,,,Y,Cambodian,4647,KS55074b1d87d65,,Inter,Inter,Inter,,,,,,,,20891,KS55074b26d815f,Preter,,,-1,,,,-1,,,,00/00/00,00/00/00,00/00/00,,,"Inter Inter vs Preter - 00/00/00",,,,,,,,-1,-1,-1,-1,,,,,-1,,
,6536,-1,1201,6839,N,,,1,KS57d1e935af818,,WC1264,,,Unassigned,,,N,,09/08/16,00/00/00,WCAB,,,,,,KS538cb2585f279,Fresno,"2550 Mariposa Mall  ","Suite 4078",Fresno,93721,FRE,Open,,,"2016-09-08 15:41:57",384,,JR,"John  Ramirez",3,N,,9698,KS57d1e98b373db,,Jacob,Ball,"Jacob Ball",,,09/09/1973,123456789,,,"564 East Cypress Street, Covina, CA 91723",55468,KS57d1e9c3e0047,"United Document Imaging","501 North Azusa Avenue, Covina, CA 91722",,-1,,,,-1,,,,09/09/15,09/09/20,00/00/00,,"Security Guards","Jacob Ball vs United Document Imaging - 09/09/15",,,3,,,TS,"Thomas Smith",-1,-1,-1,-1,,,,,-1,,
,3323,-1,1201,3299,N,,,1,KS54f7711cd7015,WC1095,,0,,Unassigned,,,N,,03/04/15,00/00/00,WCAB,2,2,2,2,3P~N,KS538cb2585f279,Fresno,"2550 Mariposa Mall  ","Suite 4078",Fresno,93721,FRE,Active,,,"2015-03-04 12:54:52",,,,,2,N,,4603,KS54f772876a339,Mr,Jean,Paul,Jean-Paul,English,05/28/89,1989-05-28,,,,,20755,KS54f7748f20a20,"Nick Corp",,,-1,,,,-1,,,,11/22/14,11/22/19,00/00/00,,driver,"Jean Paul vs Nick Corp - 11/22/14",,,2,,,NG,"Nick Giszpenc",-1,-1,-1,-1,,,,,-1,,
,41,-1,1201,115,N,,,1,KS545c04628edee,WC1056,,0,,ADJ10025,,,N,,11/06/14,00/00/00,WCAB,,,,,3P~N,KS538cb2585f04d,"Eureka ","100 ""H"" Street ","Suite 202 ","Eureka ",95501,EUR,Active,,,"2014-11-06 15:29:38",,,,,,N,,58,KS545c0966c4552,Mr,Jim,Jones,"Jim Jonesy",,03/28/01,2001-03-28,,,,"1458 S San Pedro St, Los Angeles, CA 90015",80,KS545c09b6601eb,"Star Labs","1345 San Fernando Rd, San Fernando, CA 91340",,-1,,,,-1,,,,11/01/13,11/01/18,00/00/00,,Pilot,"Jim Jones vs Star Labs - 11/01/13",,,,,,,,-1,-1,-1,-1,,,,,-1,,
,51,-1,1201,115,N,,,2,KS545c04628edee,WC1056,,0,,ADJ55878,,,N,,11/06/14,00/00/00,WCAB,,,,,3P~N,KS538cb2585f04d,"Eureka ","100 ""H"" Street ","Suite 202 ","Eureka ",95501,EUR,Active,,,"2014-11-06 15:29:38",,,,,,N,,58,KS545c0966c4552,Mr,Jim,Jones,"Jim Jonesy",,03/28/01,2001-03-28,,,,"1458 S San Pedro St, Los Angeles, CA 90015",80,KS545c09b6601eb,"Star Labs","1345 San Fernando Rd, San Fernando, CA 91340",,-1,,,,-1,,,,11/24/11,11/24/16,00/00/00,,"Homeroom Teacher","Jim Jones vs Star Labs - 11/24/11",,,,,,,,-1,-1,-1,-1,,,,,-1,,
,5899,-1,1201,6216,N,,,1,KS55ba4d0ee57e9,WC1168,,0,,Unassigned,,,N,,07/30/15,00/00/00,WCAB,,,,,,KS538cb2585ec51,Anaheim,"1065 N. PacifiCenter Dr.",,Anaheim,92806,AHM,ADA,,,"2015-07-30 09:13:02",3,,TS,"Thomas Smith",3,N,,9255,KS55ba4dace6964,Mr,Jim,McGuire,"Jim McGuire",,,05/06/1971,234560215,,,"509 N Harbor Blvd, Fullerton, CA 92832",50274,KS55ba4df175030,"Matrix Inc","509 Jones St, San Francisco, CA 94102",,-1,,,,-1,,,,09/06/72,09/06/77,00/00/00,,"Locksmiths and Safe Repairers","Jim McGuire vs Matrix Inc - 09/06/72",,,3,,,TS,"Thomas Smith",-1,-1,-1,-1,,,,,-1,,"2015-11-05 09:25:46"
,5948,-1,1201,6265,N,,,1,KS55c39205ddf68,WC1182,,0,,"ADJ6834326 ",,,N,,08/06/15,00/00/00,WCAB,,,,,,KS538cb258605b7,Redding,"2115 Civic Center Drive","Suite 15",Redding,96001,RDG,open,,,"2015-08-06 00:00:00",,,,,,N,,9338,KA55c39205ecf60,,JOANNE,RAMIREZ,"JOANNE RAMIREZ",,,,,,,"YUBA CITY, CA 95991",50726,KP55c3920601a1a,"DEPT OF SOCIAL SERVICES IHSS","PO BOX 2320   MARYSVILLE CA 95901",,-1,,,,-1,,,,10/16/08,10/16/13,00/00/00,,,"JOANNE RAMIREZ vs DEPT OF SOCIAL SERVICES IHSS - 10/16/08","JOANNE RAMIREZ vs DEPT OF SOCIAL SERVICES IHSS",,,,,,,-1,-1,-1,-1,,,,,-1,,
,6503,-1,1201,6809,N,,,1,KS5791427f5d2c4,WC1258,,,,,,,N,,07/21/16,00/00/00,WCAB,,,,,,KS538cb2585ec51,Anaheim,"1065 N. PacifiCenter Dr.",,Anaheim,92806,AHM,Open,,,"2016-07-21 14:45:35",,,,,,N,,9690,KS579143ff91c9c,,Joe,Schmeck,"Joe Schmeck",,,,,,,,55259,KS5791440b7ffc3,"Employer of Schmeck",,,-1,,,,-1,,,,00/00/00,00/00/00,00/00/00,,,"Joe Schmeck vs Employer of Schmeck - 00/00/00",,,,,,,,-1,-1,-1,-1,,,,,-1,,
,3108,-1,1201,3142,N,,,1,KS54d158e8a448b,WC1080,,0,,,,,N,,02/03/15,00/00/00,WCAB,,,,,,KS538cb2585eeb9,Bakersfield,"1800 30th Street ","Suite 100",Bakersfield,93301,BAK,Active,,,"2015-02-03 15:25:28",,,,,,N,,4382,KS54d26f2075e7d,,John,Jones,"John James Jones",,,,,,,,9167,KS54d26f2781016,"Bird Like",,,-1,,,,-1,,,,00/00/00,00/00/00,00/00/00,,,"John Jones vs Bird Like - 00/00/00",,,,,,,,-1,-1,-1,-1,,,,,-1,,
,3628,-1,1201,3559,N,,,1,KS55380301e34f7,WC1000,,0,,,,,N,,04/22/15,00/00/00,WCAB,,,,,,KS538cb2585ec51,Anaheim,"1065 N. PacifiCenter Dr.",,Anaheim,92806,AHM,,,,"2015-04-22 13:22:25",,,,,,N,,5044,KS5538030e2db7a,,John,Smoltz,"John Smoltz",,,,,,,,22498,KS553803183b179,"The Employer Corp",,,-1,,,,-1,,,,00/00/00,00/00/00,00/00/00,,,"John Smoltz vs The Employer Corp - 00/00/00",,,,,,,,-1,-1,-1,-1,,,,,-1,,
,6218,-1,1201,6532,N,,,1,KS562026390b88f,WC1197,,0,,Unassigned,,,N,,10/15/15,00/00/00,WCAB,,,,,,KS538cb2585ec51,Anaheim,"1065 N. PacifiCenter Dr.",,Anaheim,92806,AHM,Open,"Awaiting Records",,"2015-10-15 15:18:33",3,2,TS,"Thomas Smith",3,N,,9643,KS56202690b82d3,Mr,John,Walls,"John Walls",,,09/09/1975,987672345,,,"125 East Wilson Avenue, Glendale, CA 91206",52704,KS562026b508abd,"Mercury Wheels","765 Wilson Road, Pisgah Forest, NC 28768",,-1,,,,-1,,,,04/06/14,04/06/19,00/00/00,,"Chefs and Head Cooks","John Walls vs Mercury Wheels - 04/06/14",,2,3,NG,"Nick Giszpenc",TS,"Thomas Smith",-1,-1,-1,-1,,,,,-1,,
,6542,-1,1201,6845,N,,,1,KS57dc286114939,,WC1266,,,Unassigned,,,N,,09/16/16,00/00/00,WCAB,,,,,,KS538cb2585f04d,"Eureka ","100 ""H"" Street ","Suite 202 ","Eureka ",95501,EUR,Open,"Awaiting Records",,"2016-09-16 10:14:09",2,,NG,"Nick Giszpenc",3,N,,9702,KS57dc288303fcc,,John,Anderson,"John Anderson",,,,,,,"325 Wilshire Boulevard, Santa Monica, CA 90401",55515,KS57dc28967f3a0,"Matrix Inc","509 Jones St, San Francisco, CA 94102",,-1,,,,-1,,,,09/16/15,09/16/20,00/00/00,,"Adult Basic and Secondary Education and Literacy Teachers and Instructors","John Anderson vs Matrix Inc - 09/16/15",,,3,,,TS,"Thomas Smith",-1,-1,-1,-1,,,,,-1,,
,6671,-1,1201,6956,N,,,1,KS589ccba659cbf,,WC1278,,,Unassigned,,,N,,02/09/17,00/00/00,WCAB,,,,,,KS538cb2585f279,Fresno,"2550 Mariposa Mall  ","Suite 4078",Fresno,93721,FRE,Open,,,"2017-02-09 12:05:58",2,3,NG,"Nick Giszpenc",6,Y,Spanish,9716,KS589ccbe22b9a8,,John,Jones,"John Jones",,,,,,,"527 East Foothill Boulevard, Rialto, CA 92376",56494,KS589ccbf84bc71,ARS,"305 Euclid Street, Anaheim, CA 92802",,-1,,,,-1,,,,08/07/15,08/07/20,00/00/00,,"Information Security Analysts","John Jones vs ARS - 08/07/15",,3,6,TS,"Thomas Smith",merc,"Mercedes Uribe",-1,-1,-1,-1,,,,,-1,,
,5958,-1,1201,6275,N,,,1,KS55ce38e8cb2d8,WC1186,,0,,ADJ9873235,,,N,,08/14/15,00/00/00,WCAB,,,,,,KS538cb2585f792,"Los Angeles","320 W. 4th Street ","9th floor","Los Angeles",90013,LAO,open,,,"2015-08-14 00:00:00",,,,,,N,,9355,KA55ce38e8dc2fa,,JOSE,HERNANDEZ,"JOSE HERNANDEZ",,,,,,,"VAN NUYS, CA 91405",50772,KP55ce38e8ede5c,"AW COLLISION SCI","6010 YOLANDA AVE   TARZANA CA 91356",,-1,,,,-1,,,,02/23/15,02/23/20,00/00/00,,,"JOSE HERNANDEZ vs AW COLLISION SCI - 02/23/15","JOSE HERNANDEZ vs AW COLLISION SCI",,,,,,,-1,-1,-1,-1,,,,,-1,,
,6676,-1,1201,6961,N,,,1,KS58b491bc3dae5,,SS1282,SS1282,,,,disability|plaintiff,N,,02/27/17,00/00/00,social_security,,,,,,,,,,,,,Open,,,"2017-02-27 12:53:16",,,,,,N,,,,,,,,,,,,,,,-1,,,,,56532,KS58b495b759735,"Steph Carryitall",,56530,KS58b495a9acb46,"Keven Baacoon",,00/00/00,00/00/00,00/00/00,,,,"Keven Baacoon vs Steph Carryitall",,,,,,,-1,-1,-1,-1,,,,,-1,,
,6488,-1,1201,6794,N,,,1,KS578f978c1b932,PI1247,PI1247,PI1247,,,,general|plaintiff,N,,07/20/16,00/00/00,employment_law,,,,,,,,,,,,,Open,,,"2016-07-20 08:23:56",,,,,,N,,,,,,,,,,,,,,,-1,,,,,55232,KS578f97b520bcb,UPS,"5088 Chino Avenue, Chino, CA 91710",55230,KS578f979e03b32,"Kevin Mahoney","12345 Central Avenue, Chino, CA 91710",00/00/00,00/00/00,00/00/00,,,,"Kevin Mahoney vs UPS",,,,,,,-1,-1,-1,-1,,,,,-1,,
,2961,-1,1201,3037,N,,,1,KS548f5cc71349f,WC1060,,0,,ADJ0001,,,N,,12/15/14,00/00/00,WCAB,,,,,,KS538cb2585eeb9,Bakersfield,"1800 30th Street ","Suite 100",Bakersfield,93301,BAK,Active,,,"2014-12-15 14:12:23",,,,,,N,,4098,KS548f5cf0315ea,Mr,Kooper,Johnson,"Kooper Johnson",,05/05/85,1985-05-05,555888778,,,,7942,KS548f5d177cca7,"Kooper Enterprises",,,-1,,,,-1,,,,03/05/14,03/05/19,00/00/00,,Painter,"Kooper Johnson vs Kooper Enterprises - 03/05/14",,,,,,,,-1,-1,-1,-1,,,,,12,,
,3304,-1,1201,3037,N,,,2,KS548f5cc71349f,WC1060,,0,,Unassigned,,,N,,12/15/14,00/00/00,WCAB,,,,,,KS538cb2585eeb9,Bakersfield,"1800 30th Street ","Suite 100",Bakersfield,93301,BAK,Active,,,"2014-12-15 14:12:23",,,,,,N,,4098,KS548f5cf0315ea,Mr,Kooper,Johnson,"Kooper Johnson",,05/05/85,1985-05-05,555888778,,,,7942,KS548f5d177cca7,"Kooper Enterprises",,,-1,,,,-1,,,,02/22/15,02/22/20,00/00/00,,Painter,"Kooper Johnson vs Kooper Enterprises - 02/22/15",,,,,,,,-1,-1,-1,-1,,,,,-1,,
,3433,-1,1201,3373,N,,,1,KS550c8f0040bf4,WC1101,,0,,Unassigned,,,N,,03/20/15,00/00/00,WCAB,,,,,3P,KS538cb25861ac2,"Van Nuys","6150 Van Nuys Blvd. ","Suite 105","Van Nuys",91401,VNO,"Future Medical","Fees Pending","Status Conference","2015-03-20 14:20:00",1,2,av,"Angel Valero",9,N,English,4725,KS550c91671de8c,Mr,Liam,Berswitch,"Liam Berswitch",English,04/29/90,1990-04-29,606214488,liamber@yahoo.com,818-781-3356,"12293 Woodley Ave, Los Angeles, CA 91344",21065,KS550c964381387,Pools4u,"12898 Adelphia Ave, San Fernando, CA 91340",,-1,,,,-1,,,,02/20/15,02/20/20,00/00/00,,Driver,"Liam Berswitch vs Pools4u - 02/20/15",,2,9,NG,"Nick Giszpenc",jp,jp,-1,-1,-1,-1,,,,,-1,,
,3297,-1,1201,42,N,"Send all locations needed to be subpoenaed to Matrix Document Imaging.","{""suit"":"""",""jurisdiction"":"""",""case_note"":""""}",3,KS5396d067ba37b,WC0983b,54654656,0,,Unassigned,A,general,N,,06/10/14,00/00/00,WCAB,MERC,MERC,MERC,MERC,3P~N|SS~N,KS538cb25860824,Riverside,"3737 Main Street ","Suite 300",Riverside,92501,RIV,Active,"Awaiting for Change of Venue","Fees Paid","2014-06-10 04:31:19",TS,JR,,,MERC,Y,Spanish,11,KS5398d793992c8,Mr,Louis,Strongs,"Louis Strongs",Spanish,04/14/65,1965-04-14,123451233,nick@kustomweb.com,515-563-2233,"93 Manhattan Avenue, Brooklyn, NY 11206",24668,KS5552660b98178,"SALINAS FARM LABOR CONTRACTOR INC","235 East Route 66, Glendora, CA 91740",,10,KS539f3b81bfbc8,"Uber Co.","15600 Roscoe Blvd, Van Nuys, CA 91406",56528,KS58b4957cef937,"Keven McCarthy",,07/07/07,07/07/12,00/00/00,,"Laborer and Worker","Louis Strongs vs SALINAS FARM LABOR CONTRACTOR INC - 07/07/07",,,,,,,,-1,-1,-1,25161,KS55539be1aa014,"Thomas  Smith","3211 East Garvey Ave N, West Covina, CA 91791",ThomasSmith,13,,"2014-07-29 20:06:13"
,6646,-1,1201,42,N,"Send all locations needed to be subpoenaed to Matrix Document Imaging.","{""suit"":"""",""jurisdiction"":"""",""case_note"":""""}",4,KS5396d067ba37b,WC0983b,54654656,0,,Unassigned,A,general,N,,06/10/14,00/00/00,WCAB,MERC,MERC,MERC,MERC,3P~N|SS~N,KS538cb25860824,Riverside,"3737 Main Street ","Suite 300",Riverside,92501,RIV,Active,"Awaiting for Change of Venue","Fees Paid","2014-06-10 04:31:19",TS,JR,,,MERC,Y,Spanish,11,KS5398d793992c8,Mr,Louis,Strongs,"Louis Strongs",Spanish,04/14/65,1965-04-14,123451233,nick@kustomweb.com,515-563-2233,"93 Manhattan Avenue, Brooklyn, NY 11206",24668,KS5552660b98178,"SALINAS FARM LABOR CONTRACTOR INC","235 East Route 66, Glendora, CA 91740",,10,KS539f3b81bfbc8,"Uber Co.","15600 Roscoe Blvd, Van Nuys, CA 91406",56528,KS58b4957cef937,"Keven McCarthy",,12/12/12,12/12/17,00/00/00,,"Construction Laborers","Louis Strongs vs SALINAS FARM LABOR CONTRACTOR INC - 12/12/12",,,,,,,,-1,-1,-1,25161,KS55539be1aa014,"Thomas  Smith","3211 East Garvey Ave N, West Covina, CA 91791",ThomasSmith,16,,"2014-07-29 20:06:13"
,6299,-1,1201,6604,N,,,1,KS56fc5968cce28,WC1218,,WC1218,,,,,N,,03/30/16,00/00/00,NewPI,,,,,,KS538cb2585f9c2,"Marina del Rey","4720 Lincoln Blvd ","2nd floor","Marina del Rey",90292,MDR,Open,,,"2016-03-30 15:55:36",,,,,,N,,9661,KS56fc599315404,Mr,louis,weak,"louis weak",,,,444444444,,,,-1,,,,,53343,KS56fc59a2bce3a,someplace,"2340 North Hollywood Way, Burbank, CA 91505",-1,,,,00/00/00,00/00/00,00/00/00,,,"louis weak vs  - 00/00/00",,,,,,,,-1,-1,-1,-1,,,,,-1,,
,6235,-1,1201,6545,N,,,1,KS562f71b0b2248,WC1204,,0,,ADJ9589920,,,N,,10/27/15,00/00/00,WCAB,,,,,,KS538cb2585ec51,Anaheim,"1065 N. PacifiCenter Dr.",,Anaheim,92806,AHM,open,,,"2015-10-27 00:00:00",,,,,,N,,9649,KA562f71b0c55e4,,LUCILA,ARELLANO,"LUCILA ARELLANO",,,,,,,"ANAHEIM, CA 92801",52757,KP562f71b0d5670,"CRITTENTON SERVICES FOR CHILDREN AND FAMILIES","PO BOX 919   FULLERTON CA 92836",,-1,,,,-1,,,,07/27/14,07/27/19,00/00/00,,,"LUCILA ARELLANO vs CRITTENTON SERVICES FOR CHILDREN AND FAMILIES - 07/27/14","LUCILA ARELLANO vs CRITTENTON SERVICES FOR CHILDREN AND FAMILIES",,,,,,,-1,-1,-1,-1,,,,,-1,,
,6662,-1,1201,6948,N,,,1,KS5893aea928636,,PI1274,PI1274,,,,carpass|plaintiff,N,,02/02/17,00/00/00,NewPI,,,,,,,,,,,,,Open,,,"2017-02-02 14:11:53",384,1208,JR,"John  Ramirez",3,Y,Spanish,,,,,,,,,,,,,,-1,,,,,56438,KS5893af7d78270,"Armored Vehicles of America","5 Nordhoff Street, Ste 205, Los Angeles, CA 91343",56436,KS5893af49dcd6a,"Lyle Marbett","12 Cedros Avenue, Apt 2, Los Angeles, CA 91402",00/00/00,00/00/00,00/00/00,,,,"Lyle Marbett vs Armored Vehicles of America",1208,3,JS,"Juan  Spencer",TS,"Thomas Smith",-1,-1,-1,-1,,,,,-1,"2017-01-18 15:00:00",
,6498,-1,1201,6804,N,,,1,KS578fd333bc122,,PI1256,PI1256,,,,general|defendant,N,,07/20/16,00/00/00,NewPI,,,,,,,,,,,,,Open,,,"2016-07-20 12:38:27",,,,,,N,,,,,,,,,,,,,,,-1,,,,,55248,KS578fd35478df2,"Final Day",,55252,KS578fd407181e0,"Lynx Cat",,00/00/00,00/00/00,00/00/00,,,,"Lynx Cat vs Final Day",,,,,,,-1,-1,-1,-1,,,,,-1,,
,3637,-1,1201,3568,N,,,1,KS553955263612b,WC1001,,0,,ADJ9689847,,,N,,04/23/15,00/00/00,WCAB,,,,,,,,,,,,,open,,,"2015-04-23 00:00:00",,,,,,N,,5062,KA55395526441c8,,MARIA,SANCHEZ,"MARIA SANCHEZ",,,,,,,"PATTERSON, CA 95363",22583,KP553955264d6c6,"SALINAS FARM LABOR CONTRACTOR INC","PO BOX 1102   MODESTO CA 95353",,-1,,,,-1,,,,08/27/14,08/27/19,00/00/00,,,"MARIA SANCHEZ vs SALINAS FARM LABOR CONTRACTOR INC - 08/27/14","MARIA SANCHEZ vs SALINAS FARM LABOR CONTRACTOR INC",,,,,,,-1,-1,-1,-1,,,,,-1,,
,3637,-1,1201,3568,N,,,1,KS553955263612b,WC1001,,0,,ADJ9689847,,,N,,04/23/15,00/00/00,WCAB,,,,,,,,,,,,,open,,,"2015-04-23 00:00:00",,,,,,N,,5062,KA55395526441c8,,MARIA,SANCHEZ,"MARIA SANCHEZ",,,,,,,"PATTERSON, CA 95363",22585,KP5539552653bd3,"SALINAS FARM LABOR CONTRACTOR INC","P O BOX 1102   MODESTO CA 95353",,-1,,,,-1,,,,08/27/14,08/27/19,00/00/00,,,"MARIA SANCHEZ vs SALINAS FARM LABOR CONTRACTOR INC - 08/27/14","MARIA SANCHEZ vs SALINAS FARM LABOR CONTRACTOR INC",,,,,,,-1,-1,-1,-1,,,,,-1,,
,2962,-1,1201,3038,N,,,1,KS548f5ddd9f7a8,WC1061,,0,,Unassigned,,,N,,12/15/14,00/00/00,WCAB,TS,TS,TS,TS,,KS538cb2585f792,"Los Angeles","320 W. 4th Street ","9th floor","Los Angeles",90013,LAO,Active,"Awaiting WCIRB Verification",,"2014-12-15 14:17:01",,NG,,,TS,N,,4100,KS548f5e40be653,,Mary,Smith,"Mary Smith",English,,09/09/1980,123459874,,626-933-2214,"13424 Francisquito Ave, Baldwin Park, CA 91706",7945,KS548f5e810bc49,Microsoft,"100 N Barranca St, West Covina, CA 91791","Ste 102",-1,,,,-1,,,,06/09/13,06/09/18,00/00/00,,"Sales Agents, Securities and Commodities","Mary Smith vs Microsoft - 06/09/13","Terry vs Mary",,,,,,,-1,-1,-1,-1,,,,,-1,,
,6262,-1,1201,6568,N,,,1,KS56a173b8ae8dc,"new pi",,"new pi",,,,,N,,01/21/16,00/00/00,NewPI,,,,,,KS538cb2585ec51,Anaheim,"1065 N. PacifiCenter Dr.",,Anaheim,92806,AHM,Open,,,"2016-01-21 16:11:36",,,,,,N,,9654,KS56a173d15eb34,,matrix,guy,"matrix pi guy",,,,,,,,-1,,,,,53038,KS56a173df5df55,"matrix defendant",,-1,,,,00/00/00,00/00/00,00/00/00,,,"matrix guy vs  - 00/00/00","matrix pi guy vs matrix defendant",,,,,,,-1,-1,-1,-1,,,,,-1,,
,6678,-1,1201,6963,N,,,1,KS58bc2d5a009a5,,PI1284,PI1284,,,,general|plaintiff,N,,03/05/17,00/00/00,NewPI,,,,,,,,,,,,,Open,,,"2017-03-05 07:23:05",3,,TS,"Thomas Smith",2,N,,,,,,,,,,,,,,,-1,,,,,56538,KS58bc2e3473632,"Samantha Smith","Elk Grove, CA",56536,KS58bc2dff9f720,"Matthew Perera","9 Turnpost Lane, Suite 200, Pomona, CA 91766",00/00/00,00/00/00,00/00/00,,,,"Matthew Perera vs Samantha Smith",,2,,,NG,"Nick Giszpenc",-1,-1,-1,-1,,,,,-1,"2017-03-28 11:00:00",
,2994,-1,1201,3060,N,,,1,KS54b6980630294,WC1069,,0,,Unassigned,,,N,,01/14/15,00/00/00,WCAB,,,,,,KS538cb2585f792,"Los Angeles","320 W. 4th Street ","9th floor","Los Angeles",90013,LAO,Active,,,"2015-01-14 08:23:34",,6,,,3,N,,4138,KS54b6987e89c28,,Mercedes,Gomez,"Mercedes Gomez",,,09/02/1989,555555555,,,"5275 Orange Ave, Cypress, CA 90630",8197,KS54b6990fa5751,"McDonald's ","527 E Rowland St, Covina, CA 91723",,-1,,,,-1,,,,01/01/15,01/01/20,00/00/00,,"Security Guard","Mercedes Gomez vs McDonald's  - 01/01/15",,6,3,merc,"Mercedes Uribe",TS,"Thomas Smith",-1,-1,-1,-1,,,,,4,,
,6302,-1,1201,6607,N,,,1,KS56fd748b03481,WC1221,,WC1221,,,,dogbite,N,,03/31/16,00/00/00,NewPI,,,,,,KS538cb2585eeb9,Bakersfield,"1800 30th Street ","Suite 100",Bakersfield,93301,BAK,Open,,,"2016-03-31 12:03:39",,,,,,N,,9664,KS56fd7657ae91a,Mr,mike,moons,"mike moons",,,11/06/1993,102211576,mymail@emails.com,121-223-3994,"12843 Foothill Blvd, Los Angeles, CA 91342",-1,,,,,53350,KS56fd76716e1b2,someplace,"2340 North Hollywood Way, Burbank, CA 91505",-1,,,,00/00/00,00/00/00,00/00/00,,,"mike moons vs  - 00/00/00",,,,,,,,-1,-1,-1,-1,,,,,-1,,
,5951,-1,1201,6268,N,,,1,KS55c92c3528b7e,WC1184,,0,,ADJ4222945,,,N,,08/10/15,00/00/00,WCAB,,,,,,KS538cb258605b7,Redding,"2115 Civic Center Drive","Suite 15",Redding,96001,RDG,open,,,"2015-08-10 00:00:00",,,,,,N,,9343,KA55c92c3538cd2,,MOLLY,EVANS,"MOLLY EVANS",,,,,,,"OLIVEHURST, CA 95961",50740,KP55c92c354637c,"RES CARE OF CALIFORNIA","2419 COLUSA HWY   YUBA CITY CA 95993",,-1,,,,-1,,,,12/27/06,12/27/11,00/00/00,,,"MOLLY EVANS vs RES CARE OF CALIFORNIA - 12/27/06","MOLLY EVANS vs RES CARE OF CALIFORNIA",,,,,,,-1,-1,-1,-1,,,,,-1,,
,6106,-1,1201,6430,N,,,1,KS55e47ea25a632,WC1191,,0,,ADJ9868855,,,N,,08/31/15,00/00/00,WCAB,,,,,,KS538cb258602aa,Pomona,"732 Corporate Center Drive",,Pomona,91768,POM,open,,,"2015-08-31 00:00:00",,,,,,N,,9633,KA55e47ea26d84e,,NADIA,OCAMPO,"NADIA OCAMPO",,,,,,,"MONTEREY PARK, CA 91754",52193,KP55e47ea279376,"LOS COUNTY SHERIFFS DEPARTMENT","441 BAUCHET ST.   LOS ANGELES CA 90012",,-1,,,,-1,,,,03/02/14,03/06/20,03/06/15,,,"NADIA OCAMPO vs LOS COUNTY SHERIFFS DEPARTMENT - 03/02/14","NADIA OCAMPO vs LOS COUNTY SHERIFFS DEPARTMENT",,,,,,,-1,-1,-1,-1,,,,,-1,,
,5640,-1,1201,5942,N,,,1,KS558ca791b08cd,WC1155,,0,,ADJ8704617,,,N,,06/25/15,00/00/00,WCAB,,,,,,,,,,,,,open,,,"2015-06-25 00:00:00",,,,,,N,,8785,KA558ca791bfec2,,NATALIE,AWAD,"NATALIE AWAD",,,,,,,"ALISO VIEJO, CA 92656",47633,KP558ca791c9d1b,"CHUCKWALLA VALLEY STATE PRISON","PO BOX 2289   BLYTH CA 92226",,-1,,,,-1,,,,02/26/12,02/26/17,00/00/00,,,"NATALIE AWAD vs CHUCKWALLA VALLEY STATE PRISON - 02/26/12","NATALIE AWAD vs CHUCKWALLA VALLEY STATE PRISON",,,,,,,-1,-1,-1,-1,,,,,-1,,
,6466,-1,1201,6769,N,,,1,KS578560bc8f7cf,WC1229,,WC1229,,,,,N,,07/12/16,00/00/00,employment_law,,,,,,KS538cb2585eeb9,Bakersfield,"1800 30th Street ","Suite 100",Bakersfield,93301,BAK,Open,,,"2016-07-12 14:27:24",,,,,,N,,9674,KS5785610a73a1c,,Neal,Sapat,"Neal Sapat",,,06/15/1984,555555555,neel@site.com,456-454-5455,"456 San Fernando Mission Boulevard, San Fernando, CA 91340",-1,,,,,55103,KS5785617184768,MilkBone,"456 Glenoaks Boulevard, San Fernando, CA 91340",-1,,,,00/00/00,00/00/00,00/00/00,,,"Neal Sapat vs  - 00/00/00",,,,,,,,-1,-1,-1,-1,,,,,-1,,
,6417,-1,1201,6722,N,,,1,KS5750957a48e88,WC1224,,WC1224,,,,,N,,06/02/16,00/00/00,civil,,,,,,KS538cb2585eeb9,Bakersfield,"1800 30th Street ","Suite 100",Bakersfield,93301,BAK,Open,,,"2016-06-02 13:22:18",,,,,,N,,9668,KS5750962790477,,neel,baphats,"neel baphats",,,10/24/1989,555555555,neel@neel.com,454-899-9666,"323 Blythe Street, Parker Dam, CA 92267",-1,,,,,-1,,,,-1,,,,00/00/00,00/00/00,00/00/00,,,"neel baphats vs  - 00/00/00",,,,,,,,-1,-1,-1,-1,,,,,-1,,
,6203,-1,1201,6519,N,,,1,KS561d5ac250e1c,WC1195,,0,,,,,N,,10/13/15,00/00/00,WCAB,,,,,,KS538cb2585ec51,Anaheim,"1065 N. PacifiCenter Dr.",,Anaheim,92806,AHM,Open,,,"2015-10-13 12:25:54",,,,,,N,,9639,KS561d5b226f486,,new,client,"new test client",,,,,,,,-1,,,,,-1,,,,-1,,,,00/00/00,00/00/00,00/00/00,,,"new client vs  - 00/00/00",,,,,,,,-1,-1,-1,-1,,,,,-1,,
,5894,-1,1201,6212,N,,,1,KS55ba222275729,WC1164,,0,,Unassigned,,,N,,07/30/15,00/00/00,WCAB,,,,,,KS538cb2585eeb9,Bakersfield,"1800 30th Street ","Suite 100",Bakersfield,93301,BAK,,,,"2015-07-30 06:09:54",,,,,,N,,9247,KS55ba222fde00f,,Nick,Testerinoo,"Nick Testerinoo",,,,,,,,50257,KS55ba223abb631,"Some Employer",,,-1,,,,-1,,,,02/27/01,02/27/06,00/00/00,,"Customer Service Representatives","Nick Testerinoo vs Some Employer - 02/27/01",,,,,,,,-1,-1,-1,-1,,,,,-1,,"2017-04-12 14:16:04"
,5902,-1,1201,6218,N,,,1,KS55ba5e36c17fc,WC1170,,0,,Unassigned,,,N,,07/30/15,00/00/00,WCAB,,,,,,KS538cb2585f04d,"Eureka ","100 ""H"" Street ","Suite 202 ","Eureka ",95501,EUR,,,,"2015-07-30 10:26:14",,,,,,N,,9258,KS55ba5fb61169e,Mr,Nolie,Bledsoe,"Nolie Bledsoe",,,09/08/1975,,,,"509 Jones Dr, Brea, CA 92821",50280,KS55ba5fde15a80,"Pacific Bell","1150 S Olive St, Los Angeles, CA 90015",,-1,,,,-1,,,,02/02/01,02/02/06,00/00/00,,,"Nolie Bledsoe vs Pacific Bell - 02/02/01",,,,,,,,-1,-1,-1,-1,,,,,-1,,
,5903,-1,1201,6219,N,,,1,KS55ba62ee1a2c5,WC1171,,0,,Unassigned,,,N,,07/30/15,00/00/00,WCAB,,,,,,KS538cb2585ec51,Anaheim,"1065 N. PacifiCenter Dr.",,Anaheim,92806,AHM,Active,,,"2015-07-30 10:46:22",2,,NG,"Nick Giszpenc",3,N,,9259,KS55ba62f7c2ad4,Mr,Nolie,Bledsoe,"Nolie Bledsoe",,,09/08/1975,,,,"509 Jones Dr, Brea, CA 92821",50283,KS55ba630838f32,"Matrix Inc","509 Jones St, San Francisco, CA 94102",,-1,,,,-1,,,,02/27/01,06/12/17,06/12/12,,"Customer Service Representatives","Nolie Bledsoe vs Matrix Inc - 02/27/01",,,3,,,TS,"Thomas Smith",-1,-1,-1,-1,,,,,-1,,
,6490,-1,1201,6796,N,,,1,KS578fa7a6e8853,,PI1248,PI1248,,,,general|plaintiff,N,,07/20/16,00/00/00,NewPI,,,,,,,,,,,,,Open,,,"2016-07-20 09:32:38",,,,,,N,,,,,,,,,,,,,,,-1,,,,,55236,KS578fb218503dd,"PI Defendant","15403 Sherman Way, Los Angeles, CA 91406",55234,KS578fb2116061f,"Pi Plaintiff","6980 Varna Avenue, Los Angeles, CA 91405",00/00/00,00/00/00,00/00/00,,,,"Pi Plaintiff vs PI Defendant",,,,,,,-1,-1,-1,-1,,,,,-1,"2016-08-19 18:00:00",
,3988,-1,1201,3997,N,,,1,KS55550a72a73ce,WC1140,,0,,,,,N,,05/14/15,00/00/00,"Personal Injury",,,,,,KS538cb2585eeb9,Bakersfield,"1800 30th Street ","Suite 100",Bakersfield,93301,BAK,,,,"2015-05-14 13:49:54",,,,,1,N,English,5737,KS55550a8ec28c3,,purps,purps,purps,,,,454545455,,,"5450 Vesper Ave, Los Angeles, CA 91411",-1,,,,,-1,,,,-1,,,,00/00/00,00/00/00,00/00/00,,,"purps purps vs  - 00/00/00",,,1,,,av,"Angel Valero",-1,-1,-1,-1,,,,,-1,,
,6469,-1,1201,6775,N,,,1,KS5787c7158ccf0,WC1233,,0,,ADJ9296630,,,N,,07/14/16,00/00/00,WCAB,,,,,,KS538cb2585f792,"Los Angeles","320 W. 4th Street ","9th floor","Los Angeles",90013,LAO,open,,,"2016-07-14 00:00:00",,,,,,N,,9676,KA5787c7159f694,,RAMIRO,RUIZ,"RAMIRO RUIZ",,,,,,,"RIALTO, CA 91366",55123,KP5787c715b752d,"RB COMPONENT INC","1622 MARKON ST   GARDEN GROVE CA 92841",,-1,,,,-1,,,,12/05/12,12/05/17,00/00/00,,,"RAMIRO RUIZ vs RB COMPONENT INC - 12/05/12","RAMIRO RUIZ vs RB COMPONENT INC",,,,,,,-1,-1,-1,-1,,,,,-1,,
,3498,-1,1201,3445,N,,,1,KS551c31d056e3a,WC1126,,0,,ADJ9614673,,,N,,04/01/15,00/00/00,WCAB,,,,,,,,,,,,,open,,,"2015-04-01 00:00:00",,,,,,N,,4831,KA551c31d0650fd,,RICHARD,PETTIJOHN,"RICHARD PETTIJOHN",,,,,,,"LONG BEACH, CA 90803",21307,KP551c31d071207,"ANTHONY TRANSPORTATION GRP","1512 DALMATIA AVE   SAN PEDRO CA 90732",,-1,,,,-1,,,,07/21/14,07/21/19,00/00/00,,,"RICHARD PETTIJOHN vs ANTHONY TRANSPORTATION GRP - 07/21/14","RICHARD PETTIJOHN vs ANTHONY TRANSPORTATION GRP",,,,,,,-1,-1,-1,-1,,,,,-1,,
,3499,-1,1201,3446,N,,,1,KS551c31fc12080,WC1127,,0,,ADJ9614673,,,N,,04/01/15,00/00/00,WCAB,,,,,,,,,,,,,open,,,"2015-04-01 00:00:00",,,,,,N,,4832,KA551c31fc1cfa7,,RICHARD,PETTIJOHN,"RICHARD PETTIJOHN",,,,,,,"LONG BEACH, CA 90803",21311,KP551c31fc259c8,"ANTHONY TRANSPORTATION GRP","1512 DALMATIA AVE   SAN PEDRO CA 90732",,-1,,,,-1,,,,07/21/14,07/21/19,00/00/00,,,"RICHARD PETTIJOHN vs ANTHONY TRANSPORTATION GRP - 07/21/14","RICHARD PETTIJOHN vs ANTHONY TRANSPORTATION GRP",,,,,,,-1,-1,-1,-1,,,,,-1,,
,6670,-1,1201,6955,N,,,1,KS589b96999e6f3,,WC1277,,,Unassigned,,,N,,02/08/17,00/00/00,WCAB,,,,,,KS538cb2585f279,Fresno,"2550 Mariposa Mall  ","Suite 4078",Fresno,93721,FRE,Open,,,"2017-02-08 14:07:21",3,,TS,"Thomas Smith",6,Y,Spanish,9714,KS589b96e20aa37,,Robert,Jones,"Robert Jones",,06/06/72,1972-06-06,123456789,,323-705-1699,"Smith Street, Houston, TX",56489,KS589b97002a394,"Kline Industries","650 Jones Street, Yuba City, CA 95991",,-1,,,,-1,,,,02/03/16,02/03/21,00/00/00,,"Sales Agents, Securities and Commodities","Robert Jones vs Kline Industries - 02/03/16",,,6,,,merc,"Mercedes Uribe",-1,-1,-1,-1,,,,,20,,
,5906,-1,1201,6222,N,,,1,KS55ba7c4207dc3,WC1173,,0,,Unassigned,,,N,,07/30/15,00/00/00,WCAB,,,,,,KS538cb2585ec51,Anaheim,"1065 N. PacifiCenter Dr.",,Anaheim,92806,AHM,,,,"2015-07-30 12:34:26",6,3,merc,"Mercedes Uribe",2,N,,9263,KS55ba7cb3c1ae7,Ms,Robin,Green,"Robin Green",,,09/17/1948,571698048,,909-222-6477,"1819 Garland St, Pomona, CA 91766",50292,KS55ba7d38c59b3,"Pacific Bell Telephone Company","1472 Edinger Ave, Tustin, CA 92780",,-1,,,,-1,,,,02/27/02,02/27/07,00/00/00,,"Sales/Customer Service Rep.","Robin Green vs Pacific Bell Telephone Company - 02/27/02",,3,2,TS,"Thomas Smith",NG,"Nick Giszpenc",-1,-1,-1,-1,,,,,-1,,
,6513,-1,1201,6820,N,,,1,KS57a4ca8b291cf,WC1262,,0,,"ADJ9969486 ",,,N,,08/05/16,00/00/00,WCAB,,,,,,KS538cb2585ec51,Anaheim,"1065 N. PacifiCenter Dr.",,Anaheim,92806,AHM,open,,,"2016-08-05 00:00:00",,,,,,N,,9694,KA57a4ca8b38328,,RODOLFO,"DEL RIO","RODOLFO DEL RIO",,,,,,,"GARDEN GROVE, CA 92840",55321,KP57a4ca8b4fd1c,"FURNITURE TRADITIONS","1450 W COLLINS AVE   ORANGE CA 92867",,-1,,,,-1,,,,04/27/14,04/27/20,04/27/15,,,"RODOLFO DEL RIO vs FURNITURE TRADITIONS - 04/27/14","RODOLFO DEL RIO vs FURNITURE TRADITIONS",,,,,,,-1,-1,-1,-1,,,,,-1,,
,3505,-1,1201,3449,N,,,1,KS551c727cb91a4,WC1128,,0,,ADJ7320464,,,N,,04/01/15,00/00/00,WCAB,,,,,,,,,,,,,open,,,"2015-04-01 00:00:00",,,,,,N,,4838,KA551c727cc65fc,,ROSALBA,LEVESEN,"ROSALBA LEVESEN",,,,,,,"HIGHLAND, CA 92346",21328,KP551c727cd0039,IHOP,"2575 E HIGHLAND AVE   HIGHLAND CA 92346",,-1,,,,-1,,,,02/06/10,02/06/15,00/00/00,,,"ROSALBA LEVESEN vs IHOP - 02/06/10","ROSALBA LEVESEN vs IHOP",,,,,,,-1,-1,-1,-1,,,,,-1,,
,3512,-1,1201,3455,N,,,1,KS551efa03cbf17,WC1130,,0,,ADJ7937062,,,N,,04/03/15,00/00/00,WCAB,,,,,,,,,,,,,open,,,"2015-04-03 00:00:00",,,,,,N,,4850,KA551efa03d9e1a,,RUBI,LOPEZ,"RUBI LOPEZ",,,,,,,"BRENTWOOD, CA 94513",21386,KP551efa03e57bd,APPLEBEES,"2737 HILLCREST AVE   ANTIOCH CA 94509",,-1,,,,-1,,,,11/11/10,11/11/15,00/00/00,,,"RUBI LOPEZ vs APPLEBEES - 11/11/10","RUBI LOPEZ vs APPLEBEES",,,,,,,-1,-1,-1,-1,,,,,-1,,
,5883,-1,1201,6201,N,,,1,KS55a96918f2b09,WC1161,,0,,ADJ8526655,,,N,,07/17/15,00/00/00,WCAB,,,,,,,,,,,,,open,,,"2015-07-17 00:00:00",,,,,,N,,9214,KA55a969193b49f,,RUSSELL,WALLER,"RUSSELL WALLER",,,,,,,"LIVE OAK, CA 95953",50200,KP55a969196c6f8,"PLUMAS LAKE GOLF AND COUNTRY CLUB","1551 COUNTRY CLUB ROAD   OLIVEHURST CA 95961",,-1,,,,-1,,,,06/09/10,06/09/15,00/00/00,,,"RUSSELL WALLER vs PLUMAS LAKE GOLF AND COUNTRY CLUB - 06/09/10","RUSSELL WALLER vs PLUMAS LAKE GOLF AND COUNTRY CLUB",,,,,,,-1,-1,-1,-1,,,,,-1,,
,6677,-1,1201,6962,N,,,1,KS58baa2b1c2c4a,,SS1283,SS1283,,,,disability|plaintiff,N,,03/04/17,00/00/00,social_security,,,,,,,,,,,,,Open,,,"2017-03-04 03:19:13",2,,NG,"Nick Giszpenc",3,N,,,,,,,,,,,,,,,-1,,,,,-1,,,,56534,KS58baa2d67a955,"Samantha Smith","9 Turnpost Lane, Pomona, CA 91766",00/00/00,00/00/00,00/00/00,,,,"Samantha Smith",,3,,,TS,"Thomas Smith",-1,-1,-1,-1,,,,,-1,,
,6538,-1,1201,6841,N,,,1,KS57d6d4a8db32a,WC1265,,0,,ADJ8344993,,,N,,09/12/16,00/00/00,WCAB,,,,,,KS538cb2585f792,"Los Angeles","320 W. 4th Street ","9th floor","Los Angeles",90013,LAO,open,,,"2016-09-12 00:00:00",,,,,,N,,9700,KA57d6d4a8f2128,,SAMUEL,RUBIO,"SAMUEL RUBIO",,,,,,,"TORRANCE, CA 90501",55480,KP57d6d4a9199a3,"TRUMP NATIONAL GOLF CLUB","ONE OCEAN TRAILS DRIVE   RANCHO PALOS VERDES CA 90275",,-1,,,,-1,,,,04/23/12,04/23/17,00/00/00,,,"SAMUEL RUBIO vs TRUMP NATIONAL GOLF CLUB - 04/23/12","SAMUEL RUBIO vs TRUMP NATIONAL GOLF CLUB",,,,,,,-1,-1,-1,-1,,,,,-1,,
,3737,-1,1201,3699,N,,,1,KS554d2334efbb1,WC1136,,0,,ADJ9930007,,,N,,05/08/15,00/00/00,WCAB,,,,,,,,,,,,,open,,,"2015-05-08 00:00:00",,,,,,N,,5241,KA554d23350a3d9,,SANTOS,ESCUN,"SANTOS ESCUN",,,,,,,"VICTORVILLE,  92395",23545,KP554d233519b84,"CAROLINA LOGISTIC INC","120 DOGWOD RD   CANDLER NC 28715",,-1,,,,-1,,,,09/03/14,03/12/20,03/12/15,,,"SANTOS ESCUN vs CAROLINA LOGISTIC INC - 09/03/14","SANTOS ESCUN vs CAROLINA LOGISTIC INC",,,,,,,-1,-1,-1,-1,,,,,-1,,
,3738,-1,1201,3700,N,,,1,KS554d233ad7f2e,WC1137,,0,,ADJ9930007,,,N,,05/08/15,00/00/00,WCAB,,,,,,,,,,,,,open,,,"2015-05-08 00:00:00",,,,,,N,,5242,KA554d233aeb4cc,,SANTOS,ESCUN,"SANTOS ESCUN",,,,,,,"VICTORVILLE,  92395",23547,KP554d233b01b35,"CAROLINA LOGISTIC INC","120 DOGWOD RD   CANDLER NC 28715",,-1,,,,-1,,,,09/03/14,03/12/20,03/12/15,,,"SANTOS ESCUN vs CAROLINA LOGISTIC INC - 09/03/14","SANTOS ESCUN vs CAROLINA LOGISTIC INC",,,,,,,-1,-1,-1,-1,,,,,-1,,
,3739,-1,1201,3701,N,,,1,KS554d23557da4a,WC1138,,0,,ADJ9930007,,,N,,05/08/15,00/00/00,WCAB,,,,,,,,,,,,,open,,,"2015-05-08 00:00:00",,,,,,N,,5244,KA554d2355881b9,,SANTOS,ESCUN,"SANTOS ESCUN",,,,,,,"VICTORVILLE, CA 92395",23549,KP554d235596259,"CAROLINA LOGISTIC INC","120 DOGWOD RD   CANDLER NC 28715",,-1,,,,-1,,,,09/03/14,03/12/20,03/12/15,,,"SANTOS ESCUN vs CAROLINA LOGISTIC INC - 09/03/14","SANTOS ESCUN vs CAROLINA LOGISTIC INC",,,,,,,-1,-1,-1,-1,,,,,-1,,
,6511,-1,1201,6818,N,,,1,KS579fdcc7579f0,WC1261,,0,,ADJ9687058,,,N,,08/01/16,00/00/00,WCAB,,,,,,KS538cb2585ec51,Anaheim,"1065 N. PacifiCenter Dr.",,Anaheim,92806,AHM,open,,,"2016-08-01 00:00:00",,,,,,N,,9692,KA579fdcc769277,,SEYYED,BUSHEHRI,"SEYYED BUSHEHRI",,,,,,,"SHIRAZ,  71877",55298,KP579fdcc77f6f6,"KEOLIS TRANSIT AMERICA INC","13591 HARBOR BLVD   GARDEN GROVE CA 92843",,-1,,,,-1,,,,11/10/13,11/10/18,00/00/00,,,"SEYYED BUSHEHRI vs KEOLIS TRANSIT AMERICA INC - 11/10/13","SEYYED BUSHEHRI vs KEOLIS TRANSIT AMERICA INC",,,,,,,-1,-1,-1,-1,,,,,-1,,
,3506,-1,1201,3450,N,,,1,KS551c77b2eb323,WC1129,,0,,ADJ6904165,,,N,,04/01/15,00/00/00,WCAB,,,,,,,,,,,,,open,,,"2015-04-01 00:00:00",,,,,,N,,4840,KA551c77b2f3db0,,SOFIA,ESCOBAR,"SOFIA ESCOBAR",,,,,,,"DELANO, CA 93215",21348,KP551c77b308b29,"SUNVIEW VINEYARDS","1998 ROAD 152   DELANO CA 93215",,-1,,,,-1,,,,07/08/09,07/08/14,00/00/00,,,"SOFIA ESCOBAR vs SUNVIEW VINEYARDS - 07/08/09","SOFIA ESCOBAR vs SUNVIEW VINEYARDS",,,,,,,-1,-1,-1,-1,,,,,-1,,
,6470,-1,1201,6776,N,,,1,KS5787c86edd437,WC1234,,0,,ADJ9438859,,,N,,07/14/16,00/00/00,WCAB,,,,,,KS538cb2585ec51,Anaheim,"1065 N. PacifiCenter Dr.",,Anaheim,92806,AHM,open,,,"2016-07-14 00:00:00",,,,,,N,,9678,KA5787c86ee9e49,,SYED,ALI,"SYED ALI",,,,,,,"CORONA, CA 92879",55146,KP5787c86f00525,"TRIDENT USA DIANOSTIC LABORATORY","2820 N ONTARIO   BURBANK CA 91504",,-1,,,,-1,,,,10/07/13,10/07/18,00/00/00,,,"SYED ALI vs TRIDENT USA DIANOSTIC LABORATORY - 10/07/13","SYED ALI vs TRIDENT USA DIANOSTIC LABORATORY",,,,,,,-1,-1,-1,-1,,,,,-1,,
,6233,-1,1201,6543,N,,,1,KS562eb17c78c6b,WC1202,,WC1202,,Unassigned,,slipandfall,N,,10/26/15,00/00/00,NewPI,,,,,,KS538cb2585ec51,Anaheim,"1065 N. PacifiCenter Dr.",,Anaheim,92806,AHM,Open,,,"2015-10-26 16:04:28",NG,,,,,N,,9645,KS562eb191ea0d1,,Terry,Daniels,"Terry Daniels",,10/10/90,1990-10-10,123548789,,,"12345 Mountain Avenue, Chino, CA 91710",52750,KS562eb1a5a4107,"Bank of America","12345 Ventura Boulevard, Los Angeles, CA 91604",,-1,,,,-1,,,,06/22/15,06/22/20,00/00/00,,,"Terry Daniels vs Bank of America - 06/22/15",,,,,,,,-1,-1,-1,-1,,,,,-1,,
,6268,-1,1201,6573,N,,,1,KS56b10b3fdab06,WC1210,,WC1210,,,,carpass,N,,02/02/16,00/00/00,NewPI,TS,TS,TS,TS,,KS538cb2585ec51,Anaheim,"1065 N. PacifiCenter Dr.",,Anaheim,92806,AHM,Open,,,"2016-02-02 12:02:07",,NG,,,TS,N,,9656,KS56b10b838076e,,Terry,McCraney,"Terry McCraney",,12/31/69,1969-12-31,662323243,,,"527 North Azusa Avenue, Covina, CA 91722",-1,,,,,53070,KS56b10bcda903c,"Document Management","600 South Glendora Avenue, West Covina, CA 91790",-1,,,,00/00/00,00/00/00,00/00/00,,,"Terry McCraney vs  - 00/00/00","Terry McCraney vs Document Management",,,,,,,-1,-1,-1,-1,,,,,-1,"2016-08-20 15:00:00",
,6268,-1,1201,6573,N,,,1,KS56b10b3fdab06,WC1210,,WC1210,,,,carpass,N,,02/02/16,00/00/00,NewPI,TS,TS,TS,TS,,KS538cb2585ec51,Anaheim,"1065 N. PacifiCenter Dr.",,Anaheim,92806,AHM,Open,,,"2016-02-02 12:02:07",,NG,,,TS,N,,9656,KS56b10b838076e,,Terry,McCraney,"Terry McCraney",,12/31/69,1969-12-31,662323243,,,"527 North Azusa Avenue, Covina, CA 91722",-1,,,,,53776,KS570d7d29b6a4a,"Document Management","600 South Glendora Avenue, West Covina, CA 91790",-1,,,,00/00/00,00/00/00,00/00/00,,,"Terry McCraney vs  - 00/00/00","Terry McCraney vs Document Management",,,,,,,-1,-1,-1,-1,,,,,-1,"2016-08-20 15:00:00",
,6200,-1,1201,6518,N,,,1,KS5616cdf6bc4a8,WC1194,,0,,Unassigned,,,N,,10/08/15,00/00/00,WCAB,,,,,,KS538cb2585f555,"Long Beach","300 Oceangate Street","Suite 200","Long Beach",90802,LBO,Open,,,"2015-10-08 13:11:34",,,,,,N,,9637,KS5616ce8a3610f,Mr,Test,Client,"Test Client",,,09/11/1966,555015500,,,"1819 Garland Ave",52657,KS5616cf6a0f0bb,"City of Covina",,,-1,,,,-1,,,,10/08/15,10/08/20,00/00/00,,,"Test Client vs City of Covina - 10/08/15",,,,,,,,-1,-1,-1,-1,,,,,-1,,
,6479,-1,1201,6785,N,,,1,KS578e6500bfcfd,PI1238,,PI1238,,,,general|plaintiff,N,,07/19/16,00/00/00,NewPI,,,,,,,,,,,,,Open,,,"2016-07-19 10:36:00",,,,,,N,,,,,,,,,,,,,,,-1,,,,,55190,KS578e81a2624c7,"The Defendant",,55188,KS578e715d2c17e,"The Plaintiff",,00/00/00,00/00/00,00/00/00,,,,"The Plaintiff vs They Defendant",,,,,,,-1,-1,-1,-1,,,,,-1,,
,6479,-1,1201,6785,N,,,1,KS578e6500bfcfd,PI1238,,PI1238,,,,general|plaintiff,N,,07/19/16,00/00/00,NewPI,,,,,,,,,,,,,Open,,,"2016-07-19 10:36:00",,,,,,N,,,,,,,,,,,,,,,-1,,,,,55190,KS578e81a2624c7,"The Defendant",,-1,,,,00/00/00,00/00/00,00/00/00,,,,"The Plaintiff vs They Defendant",,,,,,,-1,-1,-1,-1,,,,,-1,,
,6479,-1,1201,6785,N,,,1,KS578e6500bfcfd,PI1238,,PI1238,,,,general|plaintiff,N,,07/19/16,00/00/00,NewPI,,,,,,,,,,,,,Open,,,"2016-07-19 10:36:00",,,,,,N,,,,,,,,,,,,,,,-1,,,,,55190,KS578e81a2624c7,"The Defendant",,55209,KS578ea1c643de7,"The Plaintiff",,00/00/00,00/00/00,00/00/00,,,,"The Plaintiff vs They Defendant",,,,,,,-1,-1,-1,-1,,,,,-1,,
,6479,-1,1201,6785,N,,,1,KS578e6500bfcfd,PI1238,,PI1238,,,,general|plaintiff,N,,07/19/16,00/00/00,NewPI,,,,,,,,,,,,,Open,,,"2016-07-19 10:36:00",,,,,,N,,,,,,,,,,,,,,,-1,,,,,55192,KS578e8225a9108,"Other Defendant, Inc",,55188,KS578e715d2c17e,"The Plaintiff",,00/00/00,00/00/00,00/00/00,,,,"The Plaintiff vs They Defendant",,,,,,,-1,-1,-1,-1,,,,,-1,,
,6479,-1,1201,6785,N,,,1,KS578e6500bfcfd,PI1238,,PI1238,,,,general|plaintiff,N,,07/19/16,00/00/00,NewPI,,,,,,,,,,,,,Open,,,"2016-07-19 10:36:00",,,,,,N,,,,,,,,,,,,,,,-1,,,,,55192,KS578e8225a9108,"Other Defendant, Inc",,-1,,,,00/00/00,00/00/00,00/00/00,,,,"The Plaintiff vs They Defendant",,,,,,,-1,-1,-1,-1,,,,,-1,,
,6479,-1,1201,6785,N,,,1,KS578e6500bfcfd,PI1238,,PI1238,,,,general|plaintiff,N,,07/19/16,00/00/00,NewPI,,,,,,,,,,,,,Open,,,"2016-07-19 10:36:00",,,,,,N,,,,,,,,,,,,,,,-1,,,,,55192,KS578e8225a9108,"Other Defendant, Inc",,55209,KS578ea1c643de7,"The Plaintiff",,00/00/00,00/00/00,00/00/00,,,,"The Plaintiff vs They Defendant",,,,,,,-1,-1,-1,-1,,,,,-1,,
,6479,-1,1201,6785,N,,,1,KS578e6500bfcfd,PI1238,,PI1238,,,,general|plaintiff,N,,07/19/16,00/00/00,NewPI,,,,,,,,,,,,,Open,,,"2016-07-19 10:36:00",,,,,,N,,,,,,,,,,,,,,,-1,,,,,55194,KS578e909739559,"Fourth Defendant",,55188,KS578e715d2c17e,"The Plaintiff",,00/00/00,00/00/00,00/00/00,,,,"The Plaintiff vs They Defendant",,,,,,,-1,-1,-1,-1,,,,,-1,,
,6479,-1,1201,6785,N,,,1,KS578e6500bfcfd,PI1238,,PI1238,,,,general|plaintiff,N,,07/19/16,00/00/00,NewPI,,,,,,,,,,,,,Open,,,"2016-07-19 10:36:00",,,,,,N,,,,,,,,,,,,,,,-1,,,,,55194,KS578e909739559,"Fourth Defendant",,-1,,,,00/00/00,00/00/00,00/00/00,,,,"The Plaintiff vs They Defendant",,,,,,,-1,-1,-1,-1,,,,,-1,,
,6479,-1,1201,6785,N,,,1,KS578e6500bfcfd,PI1238,,PI1238,,,,general|plaintiff,N,,07/19/16,00/00/00,NewPI,,,,,,,,,,,,,Open,,,"2016-07-19 10:36:00",,,,,,N,,,,,,,,,,,,,,,-1,,,,,55194,KS578e909739559,"Fourth Defendant",,55209,KS578ea1c643de7,"The Plaintiff",,00/00/00,00/00/00,00/00/00,,,,"The Plaintiff vs They Defendant",,,,,,,-1,-1,-1,-1,,,,,-1,,
,6479,-1,1201,6785,N,,,1,KS578e6500bfcfd,PI1238,,PI1238,,,,general|plaintiff,N,,07/19/16,00/00/00,NewPI,,,,,,,,,,,,,Open,,,"2016-07-19 10:36:00",,,,,,N,,,,,,,,,,,,,,,-1,,,,,55196,KS578e9125cc55d,"Fifth Defendant",,55188,KS578e715d2c17e,"The Plaintiff",,00/00/00,00/00/00,00/00/00,,,,"The Plaintiff vs They Defendant",,,,,,,-1,-1,-1,-1,,,,,-1,,
,6479,-1,1201,6785,N,,,1,KS578e6500bfcfd,PI1238,,PI1238,,,,general|plaintiff,N,,07/19/16,00/00/00,NewPI,,,,,,,,,,,,,Open,,,"2016-07-19 10:36:00",,,,,,N,,,,,,,,,,,,,,,-1,,,,,55196,KS578e9125cc55d,"Fifth Defendant",,-1,,,,00/00/00,00/00/00,00/00/00,,,,"The Plaintiff vs They Defendant",,,,,,,-1,-1,-1,-1,,,,,-1,,
,6479,-1,1201,6785,N,,,1,KS578e6500bfcfd,PI1238,,PI1238,,,,general|plaintiff,N,,07/19/16,00/00/00,NewPI,,,,,,,,,,,,,Open,,,"2016-07-19 10:36:00",,,,,,N,,,,,,,,,,,,,,,-1,,,,,55196,KS578e9125cc55d,"Fifth Defendant",,55209,KS578ea1c643de7,"The Plaintiff",,00/00/00,00/00/00,00/00/00,,,,"The Plaintiff vs They Defendant",,,,,,,-1,-1,-1,-1,,,,,-1,,
,6479,-1,1201,6785,N,,,1,KS578e6500bfcfd,PI1238,,PI1238,,,,general|plaintiff,N,,07/19/16,00/00/00,NewPI,,,,,,,,,,,,,Open,,,"2016-07-19 10:36:00",,,,,,N,,,,,,,,,,,,,,,-1,,,,,55198,KS578e93459b38d,"Sixth Defendant",,55188,KS578e715d2c17e,"The Plaintiff",,00/00/00,00/00/00,00/00/00,,,,"The Plaintiff vs They Defendant",,,,,,,-1,-1,-1,-1,,,,,-1,,
,6479,-1,1201,6785,N,,,1,KS578e6500bfcfd,PI1238,,PI1238,,,,general|plaintiff,N,,07/19/16,00/00/00,NewPI,,,,,,,,,,,,,Open,,,"2016-07-19 10:36:00",,,,,,N,,,,,,,,,,,,,,,-1,,,,,55198,KS578e93459b38d,"Sixth Defendant",,-1,,,,00/00/00,00/00/00,00/00/00,,,,"The Plaintiff vs They Defendant",,,,,,,-1,-1,-1,-1,,,,,-1,,
,6479,-1,1201,6785,N,,,1,KS578e6500bfcfd,PI1238,,PI1238,,,,general|plaintiff,N,,07/19/16,00/00/00,NewPI,,,,,,,,,,,,,Open,,,"2016-07-19 10:36:00",,,,,,N,,,,,,,,,,,,,,,-1,,,,,55198,KS578e93459b38d,"Sixth Defendant",,55209,KS578ea1c643de7,"The Plaintiff",,00/00/00,00/00/00,00/00/00,,,,"The Plaintiff vs They Defendant",,,,,,,-1,-1,-1,-1,,,,,-1,,
,6479,-1,1201,6785,N,,,1,KS578e6500bfcfd,PI1238,,PI1238,,,,general|plaintiff,N,,07/19/16,00/00/00,NewPI,,,,,,,,,,,,,Open,,,"2016-07-19 10:36:00",,,,,,N,,,,,,,,,,,,,,,-1,,,,,55200,KS578e9472d3b7a,"Seventh Son",,55188,KS578e715d2c17e,"The Plaintiff",,00/00/00,00/00/00,00/00/00,,,,"The Plaintiff vs They Defendant",,,,,,,-1,-1,-1,-1,,,,,-1,,
,6479,-1,1201,6785,N,,,1,KS578e6500bfcfd,PI1238,,PI1238,,,,general|plaintiff,N,,07/19/16,00/00/00,NewPI,,,,,,,,,,,,,Open,,,"2016-07-19 10:36:00",,,,,,N,,,,,,,,,,,,,,,-1,,,,,55200,KS578e9472d3b7a,"Seventh Son",,-1,,,,00/00/00,00/00/00,00/00/00,,,,"The Plaintiff vs They Defendant",,,,,,,-1,-1,-1,-1,,,,,-1,,
,6479,-1,1201,6785,N,,,1,KS578e6500bfcfd,PI1238,,PI1238,,,,general|plaintiff,N,,07/19/16,00/00/00,NewPI,,,,,,,,,,,,,Open,,,"2016-07-19 10:36:00",,,,,,N,,,,,,,,,,,,,,,-1,,,,,55200,KS578e9472d3b7a,"Seventh Son",,55209,KS578ea1c643de7,"The Plaintiff",,00/00/00,00/00/00,00/00/00,,,,"The Plaintiff vs They Defendant",,,,,,,-1,-1,-1,-1,,,,,-1,,
,6479,-1,1201,6785,N,,,1,KS578e6500bfcfd,PI1238,,PI1238,,,,general|plaintiff,N,,07/19/16,00/00/00,NewPI,,,,,,,,,,,,,Open,,,"2016-07-19 10:36:00",,,,,,N,,,,,,,,,,,,,,,-1,,,,,55215,KS578ea24559c4e,"They Defendant",,55188,KS578e715d2c17e,"The Plaintiff",,00/00/00,00/00/00,00/00/00,,,,"The Plaintiff vs They Defendant",,,,,,,-1,-1,-1,-1,,,,,-1,,
,6479,-1,1201,6785,N,,,1,KS578e6500bfcfd,PI1238,,PI1238,,,,general|plaintiff,N,,07/19/16,00/00/00,NewPI,,,,,,,,,,,,,Open,,,"2016-07-19 10:36:00",,,,,,N,,,,,,,,,,,,,,,-1,,,,,55215,KS578ea24559c4e,"They Defendant",,-1,,,,00/00/00,00/00/00,00/00/00,,,,"The Plaintiff vs They Defendant",,,,,,,-1,-1,-1,-1,,,,,-1,,
,6479,-1,1201,6785,N,,,1,KS578e6500bfcfd,PI1238,,PI1238,,,,general|plaintiff,N,,07/19/16,00/00/00,NewPI,,,,,,,,,,,,,Open,,,"2016-07-19 10:36:00",,,,,,N,,,,,,,,,,,,,,,-1,,,,,55215,KS578ea24559c4e,"They Defendant",,55209,KS578ea1c643de7,"The Plaintiff",,00/00/00,00/00/00,00/00/00,,,,"The Plaintiff vs They Defendant",,,,,,,-1,-1,-1,-1,,,,,-1,,
,5644,-1,1201,5949,N,,,1,KS558da2b0d8aff,WC1156,,0,,Unassigned,,,N,,06/26/15,00/00/00,WCAB,,,,,,KS538cb2585fe3d,Oxnard,"1901 N. Rice Ave.","Suite 200",Oxnard,93030,OXN,Open,"Expedited Hearing",,"2015-06-26 12:06:24",,,,,,N,,8791,KS558da847301ae,,Thomas,Jones,"Thomas Jones",,,09/09/1971,312458709,,,"13424 Imperial Hwy, Whittier, CA 90605",55406,KS57bb6225ae38a,"Some Employer",,,-1,,,,-1,,,,02/05/05,02/05/10,00/00/00,,,"Thomas Jones vs Some Employer - 02/05/05",,,,,,,,-1,-1,-1,-1,,,,,-1,,
,6525,-1,1201,5949,N,,,2,KS558da2b0d8aff,WC1156,,0,,ADJ9026219,,,N,,06/26/15,00/00/00,WCAB,,,,,,KS538cb2585fe3d,Oxnard,"1901 N. Rice Ave.","Suite 200",Oxnard,93030,OXN,Open,"Expedited Hearing",,"2015-06-26 12:06:24",,,,,,N,,8791,KS558da847301ae,,Thomas,Jones,"Thomas Jones",,,09/09/1971,312458709,,,"13424 Imperial Hwy, Whittier, CA 90605",55406,KS57bb6225ae38a,"Some Employer",,,-1,,,,-1,,,,06/08/13,06/08/18,00/00/00,,,"Thomas Jones vs Some Employer - 06/08/13",,,,,,,,-1,-1,-1,-1,,,,,-1,,
,5691,-1,1201,6001,N,,,1,KS5592d015d2602,WC1159,,0,,,,,N,,06/30/15,00/00/00,WCAB,,,,,,KS538cb2585eeb9,Bakersfield,"1800 30th Street ","Suite 100",Bakersfield,93301,BAK,Open,"Case Dropped",,"2015-06-30 10:21:25",,,,,,N,,8881,KS5592d03570f37,,Thomas,Smith,"Thomas Smith",,,09/09/1971,321650421,,,"527 N 8th Ave, Upland, CA 91786",-1,,,,,-1,,,,-1,,,,00/00/00,00/00/00,00/00/00,,,"Thomas Smith vs  - 00/00/00",,,,,,,,-1,-1,-1,-1,,,,,-1,,
,5898,-1,1201,6215,N,,,1,KS55ba34f35b996,WC1167,,0,,Unassigned,,,N,,07/30/15,00/00/00,WCAB,,,,,,KS538cb2585ec51,Anaheim,"1065 N. PacifiCenter Dr.",,Anaheim,92806,AHM,,,,"2015-07-30 07:30:11",2,,NG,"Nick Giszpenc",,N,,9253,KS55ba34fe1f45b,,Thomas,Nick,"Thomas Nick",,,,,,,,50268,KS55ba354bc7b75,"Mannor Inn","2359 S Grove Ave, Ontario, CA 91761",,-1,,,,-1,,,,09/09/73,09/09/78,00/00/00,,"Cooks, All Other","Thomas Nick vs Mannor Inn - 09/09/73",,,,,,,,-1,-1,-1,-1,,,,,-1,,
,6471,-1,1201,6777,N,,,1,KS5787f959841e3,WC1235,,WC1235,,,,general,N,,07/14/16,00/00/00,NewPI,TS,TS,TS,TS,,KS538cb2585f279,Fresno,"2550 Mariposa Mall  ","Suite 4078",Fresno,93721,FRE,Open,,,"2016-07-14 13:43:05",NG,,,,TS,Y,Tagalog,9684,KS5787fcfb180d9,,Thomas,Williams,"Thomas Williams",English,,,626195089,,,,-1,,,,,55156,KS5787f9ba5df73,"Kevin Mahoney Inc","501 North State College Boulevard, Fullerton, CA 92831",-1,,,,00/00/00,00/00/00,00/00/00,,,"Thomas Williams vs  - 00/00/00",,,,,,,,-1,-1,-1,-1,,,,,-1,,
,6644,-1,1201,6935,N,,,1,KS584b1eb4be7cc,,WC1269,,,Unassigned,,,N,,12/09/16,00/00/00,WCAB,,,,,,KS538cb2585f04d,"Eureka ","100 ""H"" Street ","Suite 202 ","Eureka ",95501,EUR,Open,,,"2016-12-09 13:14:28",2,,NG,"Nick Giszpenc",6,N,English,9708,KS584b1f1388ed8,,Thomas,Smith,"Thomas Smith",,,09/05/1975,236325467,,,"11221 Elkhurst Street, Santa Fe Springs, CA 90670",56346,KS584b1f4edaed2,"Imaging Service Company","100 East Arrow Highway, Pomona, CA 91767",,-1,,,,-1,,,,12/01/15,12/01/20,00/00/00,,"Security and Fire Alarm Systems Installers","Thomas Smith vs Imaging Service Company - 12/01/15",,,6,,,merc,"Mercedes Uribe",-1,-1,-1,-1,,,,,14,,
,6672,-1,1201,6957,N,,"{""suit"":"""",""jurisdiction"":"""",""case_note"":""""}",1,KS589df0bf308b3,WC1279,WC1279,0,,ADJ651051,,,N,,02/10/17,00/00/00,WCAB,TS,TS,TS,TS,,KS538cb258602aa,Pomona,"732 Corporate Center Drive",,Pomona,91768,POM,"Future Medical","Awaiting WCIRB Verification",,"2017-02-10 00:00:00",JR,NG,,,TS,N,Spanish,9718,KA589df0bf49339,,THOMAS,SMITH,"THOMAS SMITH",,05/06/72,1972-05-06,12345698X,latommy1@gmail.com,626-556-5236,"231 North Mountain View Avenue, Central LA, CA 90026",56500,KP589df0bf6380f,ARS,"13925 WHITTIER BLVD   WHITTIER CA 90605",,-1,,,,-1,,,,03/17/03,03/17/08,00/00/00,,"Bus Drivers, School or Special Client","THOMAS SMITH vs ARS - 03/17/03","THOMAS SMITH vs ARS",,,,,,,-1,-1,-1,-1,,,,,21,,
,6673,-1,1201,6958,N,,,1,KS589e0d5ab7a3e,WC1280,,0,,ADJ10739117,,,N,,02/10/17,00/00/00,WCAB,,,,,,KS538cb2585ec51,Anaheim,"1065 N. PacifiCenter Dr.",,Anaheim,92806,AHM,open,,,"2017-02-10 00:00:00",,,,,,N,,9720,KA589e0d5acc603,,THOMAS,CURRY,"THOMAS CURRY",,,,,,,"COSTA MESA, CA 92626",56515,KP589e0d5adc69b,"MERCURY INSURANCE GROUP","1700 GREENBRIAR LN   BREA CA 92822",,-1,,,,-1,,,,01/01/99,03/01/11,03/01/06,,,"THOMAS CURRY vs MERCURY INSURANCE GROUP - 01/01/99","THOMAS CURRY vs MERCURY INSURANCE GROUP",,,,,,,-1,-1,-1,-1,,,,,-1,,
,6663,-1,1201,6949,N,,"{""suit"":"""",""jurisdiction"":"""",""case_note"":""""}",1,KS5893b1f097277,PI1275,PI1275,PI1275,,,,general|defendant,Y,,02/02/17,00/00/00,employment_law,,,,,,,,,,,,,Open,,,"2017-02-02 14:25:52",,,,,,N,,,,,,,,,,,,,,,-1,,,,,56440,KS5893b229599d5,"Scott Dye","6251 San Fernando Road, Los Angeles, CA 91352",56442,KS5893b2733b3ad,"Timothy Screens","8831 San Fernando Road, Ste 56, Los Angeles, CA 91352",00/00/00,00/00/00,00/00/00,,,,"Timothy Screens vs Scott Dye",,,,,,,-1,-1,-1,-1,,,,,-1,,
,6493,-1,1201,6799,N,,,1,KS578fcbaa4698f,,PI1250,PI1250,,,,general|plaintiff,N,,07/20/16,00/00/00,employment_law,,,,,,,,,,,,,Open,,,"2016-07-20 12:06:18",,,,,,N,,,,,,,,,,,,,,,-1,,,,,55246,KS578fcbf4d6bd2,"Angel Test","4841 Hollywood Boulevard, Los Angeles, CA 90027",55244,KS578fcbcaaeb9e,"Tommy Test","15350 Sherman Way, Los Angeles, CA 91406",00/00/00,00/00/00,00/00/00,,,,"Tommy Test vs Angel Test",,,,,,,-1,-1,-1,-1,,,,,-1,,
,3153,-1,1201,3173,N,,,1,KS54d270d01df36,WC1081,,0,,,,,N,,02/04/15,00/00/00,WCAB,,,,,,KS538cb2585f04d,"Eureka ","100 ""H"" Street ","Suite 202 ","Eureka ",95501,EUR,Active,,,"2015-02-04 11:19:44",,,,,,N,,4389,KS54d270e84fc15,,Vigil,Polly,"Vigil Polly",,,,,,,,9185,KS54d270f32864f,"State Comp Insurance",,,-1,,,,-1,,,,00/00/00,00/00/00,00/00/00,,,"Vigil Polly vs State Comp Insurance - 00/00/00",,,,,,,,-1,-1,-1,-1,,,,,-1,,
,3155,-1,1201,3175,N,,,1,KS54d274bdf3dd9,WC1082,,0,,,,,N,,02/04/15,00/00/00,WCAB,,,,,,KS538cb2585f555,"Long Beach","300 Oceangate Street","Suite 200","Long Beach",90802,LBO,Active,,,"2015-02-04 11:36:29",,,,,,N,,4392,KS54d274c588d52,,Vigil,Polly,"Vigil Polly",,,,,,,,9200,KS54d274cb77c4c,"State Comp Insurance",,,-1,,,,-1,,,,00/00/00,00/00/00,00/00/00,,,"Vigil Polly vs State Comp Insurance - 00/00/00",,,,,,,,-1,-1,-1,-1,,,,,-1,,
,3291,-1,1201,3272,N,,,1,KS54ecba648822b,WC1094,,0,,,,,N,,02/24/15,00/00/00,WCAB,,,,,,KS538cb2585f04d,"Eureka ","100 ""H"" Street ","Suite 202 ","Eureka ",95501,EUR,Active,,,"2015-02-24 09:52:36",,,,,,N,,4550,KS54ecba7e9f1a6,Mr,Wally,Packer,"Wally Packer",,,,,,,,9873,KS54ecba8f9a444,"Wife Enterprises",,,-1,,,,-1,,,,00/00/00,00/00/00,00/00/00,,,"Wally Packer vs Wife Enterprises - 00/00/00",,,,,,,,-1,-1,-1,-1,,,,,-1,,
,3287,-1,1201,3268,N,,,1,KS54eba000265cd,WC1092,,0,,,,,N,,02/23/15,00/00/00,WCAB,,,,,,KS538cb2585f04d,"Eureka ","100 ""H"" Street ","Suite 202 ","Eureka ",95501,EUR,Active,,,"2015-02-23 13:47:44",12,12,JL,"John  Larson",2,N,,4542,KS54eba4e58abd2,Mr,Yolen,John,"Yolen John",English,,,,,,,9870,KS54ecba406de3a,Rolodax,,,-1,,,,-1,,,,00/00/00,00/00/00,00/00/00,,,"Yolen John vs Rolodax - 00/00/00",,12,2,JL,"John  Larson",NG,"Nick Giszpenc",-1,-1,-1,-1,,,,,-1,,
,4273,-1,1201,4326,N,,,1,KS555caa2321bdb,WC1141,,0,,ADJ6523583,,,N,,05/20/15,00/00/00,WCAB,,,,,,,,,,,,,open,,,"2015-05-20 00:00:00",,,,,,N,,6293,KA555caa232e02e,,ZENAIDA,SANCHEZ,"ZENAIDA SANCHEZ",,,,,,,"CHINO, US 91710",30554,KP555caa2335137,"COMPLETE STAFFING SERVICES","13641 CENTRAL AVE STE B   CHINO CA 91710",,-1,,,,-1,,,,11/15/06,09/09/13,09/09/08,,,"ZENAIDA SANCHEZ vs COMPLETE STAFFING SERVICES - 11/15/06","ZENAIDA SANCHEZ vs COMPLETE STAFFING SERVICES",,,,,,,-1,-1,-1,-1,,,,,-1,,
,3515,-1,1201,3458,N,,,1,KS5522c0aa8b64d,WC1131,,0,,ADJ1570448,,,N,,04/06/15,00/00/00,WCAB,,,,,,,,,,,,,open,,,"2015-04-06 00:00:00",,,,,,N,,4856,KA5522c0aa99454,,ZOWA,TULANDA,"ZOWA TULANDA",,,,,,,"LOS ANGELES, CA 90019",21439,KP5522c0aaa6390,"ATC GLOBAL","5601 W SLAUSON AVE   CULVER CITY CA 90230",,-1,,,,-1,,,,08/05/06,08/05/11,00/00/00,,,"ZOWA TULANDA vs ATC GLOBAL - 08/05/06","ZOWA TULANDA vs ATC GLOBAL",,,,,,,-1,-1,-1,-1,,,,,-1,,
